99.0,tmall,719614985727,V领泡泡袖衬衫女夏2023新款法式小众气质荷叶边别致漂亮小衫上衣,贝罗奈旗舰店,https://detail.tmall.com/item.htm?id=719614985727&ns=1&abbucket=0
20.9,taobao,719664481850,御姐风秘书性感纯欲夏天上衣衬衣套装jk制服修身ol职业白衬衫女夏,情趣阁 隐私发货,https://item.taobao.com/item.htm?id=719664481850&ns=1&abbucket=0#detail
338.0,tmall,678922791330,紫色醋酸大翻领衬衫女长袖2023年早秋新款温柔减龄宽松胖mm衬衣,cissline旗舰店,https://detail.tmall.com/item.htm?id=678922791330&ns=1&abbucket=0
80.27,taobao,721753185525,IMISS韩版条纹衬衫女短袖温柔衬衣简约百搭通勤小众上衣2023夏季,小艾韩版女装定制,https://item.taobao.com/item.htm?id=721753185525&ns=1&abbucket=0#detail
68.0,tmall,722469873425,日系小清新娃娃领格子短袖衬衫女装夏季温柔学院风宽松显瘦上衣服,姬粉思旗舰店,https://detail.tmall.com/item.htm?id=722469873425&ns=1&abbucket=0
59.0,tmall,678708450174,白色v领肌理感短袖衬衫女夏季宽松别致衬衣法式小众设计雪纺上衣,淘米迪旗舰店,https://detail.tmall.com/item.htm?id=678708450174&ns=1&abbucket=0
85.0,taobao,722459835161,森系甜美衬衫女套头气质高级感小众少女温柔风减龄娃娃衫2023夏季,chic Girl 韩国ulzz,https://item.taobao.com/item.htm?id=722459835161&ns=1&abbucket=0#detail
78.0,tmall,699909539773,蓝色娃娃领衬衫女春秋法式温柔小个子甜美设计感小众衬衣仙气上衣,范未儿旗舰店,https://detail.tmall.com/item.htm?id=699909539773&ns=1&abbucket=0
79.0,taobao,713687152931,法式气质外穿奶杏色衬衫女夏设计感小众波点衬衣短袖温柔气质上衣,Flourishing芊芊家轻奢女装,https://item.taobao.com/item.htm?id=713687152931&ns=1&abbucket=0#detail
84.0,taobao,680821412652,法式大翻娃娃领蕾丝衬衫女春秋2023新款长袖超仙甜美温柔别致上衣,MoonNa 月亮娜娜,https://item.taobao.com/item.htm?id=680821412652&ns=1&abbucket=0#detail
79.0,taobao,710491256171,夏季新款韩系温柔风设计感后背绑带镂空绣花上衣V领泡泡袖衬衫女,violet 轻奢定制,https://item.taobao.com/item.htm?id=710491256171&ns=1&abbucket=0#detail
79.9,tmall,641103794645,波点印花衬衫复古港味新款2023年法式温柔风小众短袖上衣女夏衬衣,baabibaaby旗舰店,https://detail.tmall.com/item.htm?id=641103794645&ns=1&abbucket=0
79.0,taobao,721825086783,一字肩系带泡泡袖雪纺衬衫女夏季新款温柔宽松洋气小衫小个子上衣,杭州婉儿四季青批发女装,https://item.taobao.com/item.htm?id=721825086783&ns=1&abbucket=0#detail
69.9,tmall,704548003074,双层荷叶边娃娃领衬衫女设计感小众温柔奶系长袖撞色雪纺衫上衣春,惜闻女装旗舰店,https://detail.tmall.com/item.htm?id=704548003074&ns=1&abbucket=0
69.0,taobao,711911829834,AFTER 18韩版设计感小众圆领泡泡袖衬衫女夏宽松纯色温柔气质百搭,上上衣馆,https://item.taobao.com/item.htm?id=711911829834&ns=1&abbucket=0#detail
219.0,tmall,692859881132,衣纱布菲甜璐甜美雪纺衬衫女2023年春季新款娃娃领蝴蝶结长袖衬衣,isabufei衣纱布菲旗舰店,https://detail.tmall.com/item.htm?id=692859881132&ns=1&abbucket=0
74.0,tmall,722600141506,无袖垫肩条纹短袖衬衫女夏季新款慵懒风韩系美式复古港风chic上衣,凤奢旗舰店,https://detail.tmall.com/item.htm?id=722600141506&ns=1&abbucket=0
305.1,tmall,675700090192,黑色泡泡袖衬衫薄款2023新款夏季宽松洋气温柔系穿搭时尚上衣女,doneed女装旗舰店,https://detail.tmall.com/item.htm?id=675700090192&ns=1&abbucket=0
38.9,tmall,702638131009,白色衬衫女春秋设计感小众衬衣2023新款法式温柔荷叶边长袖上衣,楠素姬旗舰店,https://detail.tmall.com/item.htm?id=702638131009&ns=1&abbucket=0
284.05,tmall,710758402513,爱客2023夏季新款简约小众长袖衬衫女韩版修身别致温柔衬衣上衣,爱客女装旗舰店,https://detail.tmall.com/item.htm?id=710758402513&ns=1&abbucket=0
129.0,taobao,705857158030,2023春秋新款温柔挺括版型衬衫显瘦女温柔浅黄色单排扣衬衫上衣,AMAN STU,https://item.taobao.com/item.htm?id=705857158030&ns=1&abbucket=0#detail
24.8,tmall,703219100354,复古法式宫廷风花边衬衫女2023春秋新款尖领双面缎温柔气质衬衣女,淘工厂官方店,https://detail.tmall.com/item.htm?id=703219100354&ns=1&abbucket=0
59.0,taobao,720935067725,卡通动物涂鸦印花短袖衬衫女夏新款港风复古设计感宽松小个子衬衣,ANAMONE STUDIO,https://item.taobao.com/item.htm?id=720935067725&ns=1&abbucket=0#detail
173.0,tmall,694924862979,2023春季法式别致小众设计感蓝色条纹衬衫内搭温柔系长袖小上衣女,欧芝妍旗舰店,https://detail.tmall.com/item.htm?id=694924862979&ns=1&abbucket=0
55.0,taobao,723718422715,奥特莱斯专柜清仓哥弟大牌尾货剪标温柔风花边短款衬衫女夏季上衣,奥特莱斯主营店,https://item.taobao.com/item.htm?id=723718422715&ns=1&abbucket=0#detail
48.0,taobao,719046920655,法式温柔风气质蕾丝拼接白色衬衫女夏季洋气宽松遮肚子飞飞袖上衣,JEMMA STUDIO 女装原创定制,https://item.taobao.com/item.htm?id=719046920655&ns=1&abbucket=0#detail
38.8,tmall,702198188727,娅丽娅幂式格子衬衫女春夏慵懒薄款防晒衬衣外套设计感长袖上衣女,天天特卖工厂店,https://detail.tmall.com/item.htm?id=702198188727&ns=1&abbucket=0
24.9,tmall,721465013563,夏装短袖外套连帽女士复古港味风设计感小众日系cityboy格子衬衫,天天特卖工厂店,https://detail.tmall.com/item.htm?id=721465013563&ns=1&abbucket=0
79.0,tmall,672948274252,法式肌理感短袖衬衫女夏季遮肉显瘦泡泡袖娃娃衫方领别致小衫上衣,追媚旗舰店,https://detail.tmall.com/item.htm?id=672948274252&ns=1&abbucket=0
41.96,taobao,680778443590,白色衬衫女春季2023年新款宽松百搭职业面试衬衣抗皱缎面长袖上衣,小新家 每天上新,https://item.taobao.com/item.htm?id=680778443590&ns=1&abbucket=0#detail
38.0,taobao,636580684493,【朴樱原创】jk衬衫长袖短袖风琴褶基础款日系学院风百搭白衬衣女,朴樱JK原创制服馆,https://item.taobao.com/item.htm?id=636580684493&ns=1&abbucket=0#detail
69.8,tmall,714636779775,夏季新款日系学院风娃娃领甜美短袖衬衫女设计感小众卡通印花上衣,赛尔摩旗舰店,https://detail.tmall.com/item.htm?id=714636779775&ns=1&abbucket=0
49.8,tmall,642323905306,法式复古短袖衬衫女夏2023新款小清新甜美短款方领上衣设计感小众,赛尔摩旗舰店,https://detail.tmall.com/item.htm?id=642323905306&ns=1&abbucket=0
58.0,taobao,708540166869,小雨良品 日系奶系甜美娃娃领泡泡袖短袖衬衫女夏季茶歇法式上衣,小雨良品 日系少女风女装,https://item.taobao.com/item.htm?id=708540166869&ns=1&abbucket=0#detail
199.9,tmall,721880435725,时尚气质短袖衬衫2023年夏季新款淑女温柔翻领宽松显瘦通勤上衣,苏醒的乐园旗舰店,https://detail.tmall.com/item.htm?id=721880435725&ns=1&abbucket=0
66.0,taobao,669052791446,蓝色衬衫女高级感2022早春长袖上衣设计感小众轻熟气质职业白衬衣,MISS U 鱿小姐小众设计,https://item.taobao.com/item.htm?id=669052791446&ns=1&abbucket=0#detail
63.68,tmall,677487970031,黑白格子锁骨方领衬衫女夏设计感小众甜美荷叶边娃娃衫小飞袖上衣,赛帛莉旗舰店,https://detail.tmall.com/item.htm?id=677487970031&ns=1&abbucket=0
59.0,taobao,642916103033,粉色衬衫女短袖夏季显瘦教师穿搭服装教资面试套装职业白色衬衣,Make 美刻女装,https://item.taobao.com/item.htm?id=642916103033&ns=1&abbucket=0#detail
65.0,taobao,674597788891,夏木耳边娃娃领雪纺衫白色衬衫女职业设计感小众别致上衣短袖衬衣,素言轻奢女装studio,https://item.taobao.com/item.htm?id=674597788891&ns=1&abbucket=0#detail
59.0,tmall,723959006150,杏色新中式翻领短袖衬衫女夏季新款短款盘扣小衫洋气独特别致上衣,赐律旗舰店,https://detail.tmall.com/item.htm?id=723959006150&ns=1&abbucket=0
69.0,taobao,622721166324,雪纺白衬衫女设计感小众2023春秋冬新款复古港味内搭叠穿法式上衣,悟空自制,https://item.taobao.com/item.htm?id=622721166324&ns=1&abbucket=0#detail
68.0,tmall,675634422468,大码设计感小众法式衬衫女夏季薄款胖妹妹mm宽松显瘦别致短袖上衣,惠夏旗舰店,https://detail.tmall.com/item.htm?id=675634422468&ns=1&abbucket=0
79.0,tmall,703041876241,韩系chic粉色防晒衬衫女夏季设计感小众宽松衬衣欧货漂亮时尚上衣,朵妃嫣旗舰店,https://detail.tmall.com/item.htm?id=703041876241&ns=1&abbucket=0
69.0,tmall,680235721685,2022新款百搭水墨印花翻领夏季薄款防晒衬衫女垂感雪纺别致上衣,本凡印象旗舰店,https://detail.tmall.com/item.htm?id=680235721685&ns=1&abbucket=0
89.0,tmall,702969831896,粉色纯棉衬衫女春秋设计感小众衬衣高级感小个子法式别致长袖上衣,丹萌妃旗舰店,https://detail.tmall.com/item.htm?id=702969831896&ns=1&abbucket=0
33.9,tmall,710743498627,茶歇法式白色衬衫女款2023年新款春夏设计感小众漂亮雪纺蕾丝衬衣,琪力玛旗舰店,https://detail.tmall.com/item.htm?id=710743498627&ns=1&abbucket=0
49.9,tmall,675395224700,慕兔ins港风复古宽松短袖花衬衫女2023夏季新款设计感小众上衣潮,慕兔旗舰店,https://detail.tmall.com/item.htm?id=675395224700&ns=1&abbucket=0
149.0,taobao,675993419817,拉夏贝尔/La Chapelle防晒衬衫女衬衣西装短裤上衣两件套空调衫,拉夏贝尔官方店,https://item.taobao.com/item.htm?id=675993419817&ns=1&abbucket=0#detail
48.0,tmall,638133654425,帛卡琪2022新款百搭立领衬衫女学生盘扣洋气荷叶边短袖白衬衣夏装,帛卡琪旗舰店,https://detail.tmall.com/item.htm?id=638133654425&ns=1&abbucket=0
139.0,tmall,641484728526,茵曼旗舰店官方官网纯棉蓝色衬衫女短袖衬衣2023夏季新款法式上衣,inman茵曼欧瑞专卖店,https://detail.tmall.com/item.htm?id=641484728526&ns=1&abbucket=0
68.0,tmall,718884131064,法式复古郁金香刺绣短袖衬衫女夏季设计感小众别致雪纺泡泡袖上衣,淘米迪旗舰店,https://detail.tmall.com/item.htm?id=718884131064&ns=1&abbucket=0
189.0,tmall,715567674894,衣纱布菲鹄心 OL气质雪纺衬衫2023新款女夏季polo领时尚修身衬衣,isabufei衣纱布菲旗舰店,https://detail.tmall.com/item.htm?id=715567674894&ns=1&abbucket=0
44.96,taobao,681611537908,春季法式别致条纹长袖衬衫女装设计感小众通勤职业衬衣高级感上衣,小新家 每天上新,https://item.taobao.com/item.htm?id=681611537908&ns=1&abbucket=0#detail
79.0,taobao,675119981361,日系甜美泡泡袖棉麻衬衫女夏季薄娃娃衫防晒衬衣可爱减龄宽松上衣,金蘑咕咕STUDIO自制,https://item.taobao.com/item.htm?id=675119981361&ns=1&abbucket=0#detail
64.99,taobao,669789080487,茉语家2023别致漂亮小衫短袖娃娃领衬衣设计感小众上衣盐系衬衫女,茉语家,https://item.taobao.com/item.htm?id=669789080487&ns=1&abbucket=0#detail
159.0,taobao,713417206488,边缝原创文艺蓝色短袖衬衫女设计感小众2023年新款圆领纯棉衬衣夏,边缝sideseam原创自制,https://item.taobao.com/item.htm?id=713417206488&ns=1&abbucket=0#detail
68.0,taobao,626476619491,【御茶家】鲸屿白色短袖衬衫 jk制服女士上衣日系春夏秋长袖刺绣,御茶家,https://item.taobao.com/item.htm?id=626476619491&ns=1&abbucket=0#detail
113.05,tmall,711113671163,原水2023新款夏季女上衣雪纺短袖设计感小众荷叶边法式蓝色衬衫,原水旗舰店,https://detail.tmall.com/item.htm?id=711113671163&ns=1&abbucket=0
79.0,taobao,719069999111,重工刺绣宽松短袖衬衫女夏款设计感小众衬衣温柔韩系可爱甜美上衣,车厘子红了 cherry,https://item.taobao.com/item.htm?id=719069999111&ns=1&abbucket=0#detail
69.9,tmall,678348483705,慕兔法式甜美短袖白衬衫女2023夏季新款设计感小众娃娃领短款上衣,慕兔旗舰店,https://detail.tmall.com/item.htm?id=678348483705&ns=1&abbucket=0
189.0,taobao,697245103445,VEGA CHANG白色小花衬衫女设计感小众法式灯笼袖蕾丝上衣春秋新款,VEGA CHANG 概念店,https://item.taobao.com/item.htm?id=697245103445&ns=1&abbucket=0#detail
39.98,taobao,709467069207,大码女装法式温柔泡泡短袖雪纺碎花衬衫女设计感小众夏季显瘦上衣,叽咕叽咕家大码女装,https://item.taobao.com/item.htm?id=709467069207&ns=1&abbucket=0#detail
69.0,tmall,714635130740,粉色翻领天丝防晒衬衫女夏季薄款外搭垂感衬衣小个子休闲长袖上衣,婉扮旗舰店,https://detail.tmall.com/item.htm?id=714635130740&ns=1&abbucket=0
59.0,tmall,688379643865,2023新款条纹衬衫女打底叠穿高级感设计感小众内搭上衣衬衣春秋款,懿芷旗舰店,https://detail.tmall.com/item.htm?id=688379643865&ns=1&abbucket=0
54.0,taobao,640458951425,MATTUCLB 设计感小众短袖衬衫女夏季新款韩版宽松外穿短款上衣潮,MATTUCLB STUDIO,https://item.taobao.com/item.htm?id=640458951425&ns=1&abbucket=0#detail
69.0,taobao,621405971218,盐系复古桔梗印花衬衫女夏港味chic温柔设计感原宿BF风半袖衬衣潮,扑通扑通少女心丶,https://item.taobao.com/item.htm?id=621405971218&ns=1&abbucket=0#detail
59.0,tmall,720993396385,蓝色褶皱短袖衬衫女夏2023新款法式设计感小众衬衣polo领正肩上衣,微悟旗舰店,https://detail.tmall.com/item.htm?id=720993396385&ns=1&abbucket=0
56.9,tmall,675228431144,白色雪纺衬衫女夏装2023年新款高级感飘带职业衬衣温柔风短袖上衣,碧姿瑶旗舰店,https://detail.tmall.com/item.htm?id=675228431144&ns=1&abbucket=0
69.0,taobao,635759166568,白色雪纺衬衫女正装上衣蝴蝶结职业气质高级感衬衣长袖春秋系带,SSI轻奢时尚女装,https://item.taobao.com/item.htm?id=635759166568&ns=1&abbucket=0#detail
139.0,taobao,653205327484,JIUJIU木耳边娃娃领衬衫女设计感小众夏季2023新款长袖宽松衬衣女,JIUJIU,https://item.taobao.com/item.htm?id=653205327484&ns=1&abbucket=0#detail
62.0,taobao,651760065087,岚山雾雨【花间酒】原创 JK衬衫长袖 jk刺绣衬衣白夏薄款JK上衣,岚山雾雨,https://item.taobao.com/item.htm?id=651760065087&ns=1&abbucket=0#detail
89.0,tmall,702969831896,粉色纯棉衬衫女春秋设计感小众衬衣高级感小个子法式别致长袖上衣,丹萌妃旗舰店,https://detail.tmall.com/item.htm?id=702969831896&ns=1&abbucket=0
189.0,taobao,707768400364,cpaia茜派雅23原创印花V领法式复古衬衫女设计感小众松弛感防晒衫,Cpaia 茜派雅,https://item.taobao.com/item.htm?id=707768400364&ns=1&abbucket=0#detail
39.98,taobao,709467069207,大码女装法式温柔泡泡短袖雪纺碎花衬衫女设计感小众夏季显瘦上衣,叽咕叽咕家大码女装,https://item.taobao.com/item.htm?id=709467069207&ns=1&abbucket=0#detail
58.8,taobao,678504732657,蓝色短袖衬衫女夏季设计感小众公务员雪纺衬衣高级感职业面试上衣,小C家职业女装,https://item.taobao.com/item.htm?id=678504732657&ns=1&abbucket=0#detail
40.96,taobao,668883418931,蓝色衬衫女春季2023新款设计感小众V领上衣职业气质正装面试衬衣,小新家 每天上新,https://item.taobao.com/item.htm?id=668883418931&ns=1&abbucket=0#detail
109.0,taobao,679087256101,拉夏贝尔/La Chapelle夏天丝衬衫女撞色条纹薄款防晒空调衫上衣,拉夏贝尔官方店,https://item.taobao.com/item.htm?id=679087256101&ns=1&abbucket=0#detail
59.9,tmall,685503551608,早春季chic上衣小众设计感2023年新款衬衣韩系法式温柔长袖衬衫女,y6y旗舰店,https://detail.tmall.com/item.htm?id=685503551608&ns=1&abbucket=0
45.9,tmall,707940594154,法式白色衬衫上衣女春秋设计感小众气质别致职业内搭叠穿长袖衬衣,y6y旗舰店,https://detail.tmall.com/item.htm?id=707940594154&ns=1&abbucket=0
34.5,tmall,712443578266,正装衬衫女长袖白色上衣春秋夏季职业缎面气质OL垂感宽松工作衬衣,天天特卖工厂店,https://detail.tmall.com/item.htm?id=712443578266&ns=1&abbucket=0
149.0,taobao,645758703459,Tide Blend白色缎面职业通勤套装设计感小众面试上衣短袖衬衫女夏,TideBlend Studio,https://item.taobao.com/item.htm?id=645758703459&ns=1&abbucket=0#detail
20.52,tmall,717436181781,胖妹妹港味复古短袖花T恤女设计感小众雪纺衬衫大码遮肉碎花上衣,天天特卖工厂店,https://detail.tmall.com/item.htm?id=717436181781&ns=1&abbucket=0
69.8,tmall,714417490257,2023夏季新款法式甜美短袖衬衫女小个子设计感小众学院风高腰上衣,赛尔摩旗舰店,https://detail.tmall.com/item.htm?id=714417490257&ns=1&abbucket=0
35.96,taobao,680615933171,幂式穿搭格子衬衫女慵懒风复古宽松衬衣开衫外套长袖上衣春秋季,小新家 每天上新,https://item.taobao.com/item.htm?id=680615933171&ns=1&abbucket=0#detail
55.0,taobao,671418122995,奶甜蓝荷叶边雪纺衫女纯欲风长袖衬衫设计感别致上衣2023春秋新款,依雅舒EYASHU,https://item.taobao.com/item.htm?id=671418122995&ns=1&abbucket=0#detail
189.0,taobao,675654505836,边缝「邻家女孩」粉色短袖衬衫女夏季薄款日系文艺两面穿亚麻衬衣,边缝sideseam原创自制,https://item.taobao.com/item.htm?id=675654505836&ns=1&abbucket=0#detail
69.0,tmall,649728378844,小清新方领短袖衬衫女夏薄款2023新款设计感小众短款泡泡袖上衣,顶津服饰旗舰店,https://detail.tmall.com/item.htm?id=649728378844&ns=1&abbucket=0
59.0,tmall,644418370781,2023夏季新款复古港风黑色短袖衬衫女夏花朵刺绣设计感衬衣ins潮,孜索旗舰店,https://detail.tmall.com/item.htm?id=644418370781&ns=1&abbucket=0
62.0,taobao,651760065087,岚山雾雨【花间酒】原创 JK衬衫长袖 jk刺绣衬衣白夏薄款JK上衣,岚山雾雨,https://item.taobao.com/item.htm?id=651760065087&ns=1&abbucket=0#detail
69.0,taobao,635759166568,白色雪纺衬衫女正装上衣蝴蝶结职业气质高级感衬衣长袖春秋系带,SSI轻奢时尚女装,https://item.taobao.com/item.htm?id=635759166568&ns=1&abbucket=0#detail
124.0,tmall,703632068811,法式上衣女装夏季新款小众高级感韩系穿搭娃娃衫甜美长袖白色衬衫,夏珍旗舰店,https://detail.tmall.com/item.htm?id=703632068811&ns=1&abbucket=0
79.0,tmall,677985791931,娃娃领泡泡袖雪纺短袖碎花衬衫女夏季衬衣小衫设计感小众别致上衣,欧茹雪旗舰店,https://detail.tmall.com/item.htm?id=677985791931&ns=1&abbucket=0
34.9,taobao,719251069486,自制夏季新款法式温柔风气质荷叶边纯棉刺绣飞飞袖衬衫女短款上衣,Du Form白小默,https://item.taobao.com/item.htm?id=719251069486&ns=1&abbucket=0#detail
30.98,taobao,615058113237,春季内搭长袖衬衫高级设计感小众衬衣女奶系温柔别致独特法式上衣,三木子快时尚女装,https://item.taobao.com/item.htm?id=615058113237&ns=1&abbucket=0#detail
229.0,tmall,639002070309,TeenieWeenie小熊甜美风衬衫女木耳边新疆棉衬衫盐系短袖女上衣,TeenieWeenie官方旗舰店,https://detail.tmall.com/item.htm?id=639002070309&ns=1&abbucket=0
89.0,taobao,714164364400,拉夏贝尔/La Chapelle夏季清新减龄领结短袖衬衫女式显瘦雪纺上衣,拉夏贝尔品牌正品店,https://item.taobao.com/item.htm?id=714164364400&ns=1&abbucket=0#detail
59.9,tmall,723130271017,新中式法式泡泡袖短袖衬衫女2023新款夏季别致修身短款设计感上衣,艾偲琳旗舰店,https://detail.tmall.com/item.htm?id=723130271017&ns=1&abbucket=0
76.5,taobao,705625086748,软奶蓝宽松休闲洋气衬衫女春夏装日系温柔风叠穿搭男友风防晒上衣,六木子,https://item.taobao.com/item.htm?id=705625086748&ns=1&abbucket=0#detail
39.9,tmall,639258879506,白色衬衫女设计感小众上衣2023春季韩版宽松文艺bf风休闲长袖衬衣,韩雪人旗舰店,https://detail.tmall.com/item.htm?id=639258879506&ns=1&abbucket=0
79.9,tmall,706949843879,慕兔法式复古V领短袖上衣女2023夏季新款别致镂空设计感小众衬衫,慕兔旗舰店,https://detail.tmall.com/item.htm?id=706949843879&ns=1&abbucket=0
79.0,taobao,641880713403,短袖衬衣夏季高级设计感小众薄款v领碎花上衣别致法式雪纺衬衫女,MOLINGER茉灵儿,https://item.taobao.com/item.htm?id=641880713403&ns=1&abbucket=0#detail
59.9,tmall,717166050355,防晒棉麻衬衫外套气质薄款上衣设计感小众衬衣女款夏季2023年新款,杏花恋旗舰店,https://detail.tmall.com/item.htm?id=717166050355&ns=1&abbucket=0
46.98,taobao,678890176712,法式甜美小飞袖白色格子衬衫女夏季无袖显瘦别致娃娃衫短款上衣,梦露日记,https://item.taobao.com/item.htm?id=678890176712&ns=1&abbucket=0#detail
69.0,taobao,621405971218,盐系复古桔梗印花衬衫女夏港味chic温柔设计感原宿BF风半袖衬衣潮,扑通扑通少女心丶,https://item.taobao.com/item.htm?id=621405971218&ns=1&abbucket=0#detail
229.0,taobao,705353253917,万有引力博物馆 褶皱肌理感短袖花衬衫女夏季2023年新款宽松上衣,万有引力博物馆,https://item.taobao.com/item.htm?id=705353253917&ns=1&abbucket=0#detail
39.9,taobao,673367924449,MANNSTU 夏季日系短袖衬衫女 学院风休闲中性半袖上衣薄款衬衣男,MANNSTU(原蔓娜工作室),https://item.taobao.com/item.htm?id=673367924449&ns=1&abbucket=0#detail
159.49,taobao,669217522917,SEEKSIMPLE 荷叶边衬衫女装2023早春设计感小众衬衣长袖法式上衣,SEEKSIMPLE,https://item.taobao.com/item.htm?id=669217522917&ns=1&abbucket=0#detail
49.9,tmall,717975117643,法式复古文艺棉麻防晒衬衫女夏季宽松设计感小众上衣长袖衬衣外套,韩雪人旗舰店,https://detail.tmall.com/item.htm?id=717975117643&ns=1&abbucket=0
68.0,tmall,718884131064,法式复古郁金香刺绣短袖衬衫女夏季设计感小众别致雪纺泡泡袖上衣,淘米迪旗舰店,https://detail.tmall.com/item.htm?id=718884131064&ns=1&abbucket=0
39.9,tmall,707578790376,夏季2023年白色衬衫女高级设计感小众法式短袖衬衣别致上衣小个子,加迪波尔旗舰店,https://detail.tmall.com/item.htm?id=707578790376&ns=1&abbucket=0
69.8,tmall,719660705933,2023夏季新款白色雪纺衬衫外套女轻薄空调开衫外套防晒上衣小个子,赛尔摩旗舰店,https://detail.tmall.com/item.htm?id=719660705933&ns=1&abbucket=0
126.65,tmall,698458337897,热风2023年夏季新款女士方领娃娃衬衫洋气减龄短款上衣女,热风旗舰店,https://detail.tmall.com/item.htm?id=698458337897&ns=1&abbucket=0
59.0,taobao,644839783543,逃离地球复古油画花短袖衬衫女大码港风外穿宽松衬衣夏季薄款国潮,逃离地球 情报局,https://item.taobao.com/item.htm?id=644839783543&ns=1&abbucket=0#detail
289.0,tmall,704461942277,红袖天丝衬衫设计感高级夏季2023新款女装落肩翻领宽松垂感上衣,红袖官方旗舰店,https://detail.tmall.com/item.htm?id=704461942277&ns=1&abbucket=0
69.0,tmall,716444895484,日系小清新印花短袖衬衫女夏2023新款设计感小众法式甜美宽松上衣,顶津服饰旗舰店,https://detail.tmall.com/item.htm?id=716444895484&ns=1&abbucket=0
69.0,taobao,642140939751,木禾jk制服衬衫女荒川中原创刺绣白色学院夏季方领短袖长袖衬衣现,木禾JK制服馆,https://item.taobao.com/item.htm?id=642140939751&ns=1&abbucket=0#detail
134.25,taobao,680397930280,安妮陈春装薄款衬衫女士简约法式上衣衬衣温柔浅蓝色设计感小众,安妮陈 原创设计师品牌 都市复古风,https://item.taobao.com/item.htm?id=680397930280&ns=1&abbucket=0#detail
39.98,taobao,716789364428,法式甜辣妹洋气减龄polo领短袖衬衫女夏季温柔系凡尔赛上衣衬衣女,Ele classm十一同学,https://item.taobao.com/item.htm?id=716789364428&ns=1&abbucket=0#detail
43.98,taobao,713324716553,夏季2023年法式温柔风后背蝴蝶结设计小众海边度假防晒衬衫女装,卡兰语琪潮流女装,https://item.taobao.com/item.htm?id=713324716553&ns=1&abbucket=0#detail
41.98,taobao,710164364461,法式甜美荷叶边粉色小飞袖衬衫女夏季小众设计感洋气温柔短款小衫,拾柒同学,https://item.taobao.com/item.htm?id=710164364461&ns=1&abbucket=0#detail
58.0,taobao,724800571539,温柔风白色方领泡泡袖系带衬衫女夏季法式甜美短款显瘦小个子上衣,AegeLa CLUB,https://item.taobao.com/item.htm?id=724800571539&ns=1&abbucket=0#detail
42.5,taobao,720586105919,大码女装韩版胖mm温柔风波点镂空短袖上衣夏季新款百褶圆领衬衫,淘上美伊时尚女装店,https://item.taobao.com/item.htm?id=720586105919&ns=1&abbucket=0#detail
69.8,tmall,706465824317,设计感小众衬衫夏季2023年新款娃娃领女士装短袖上衣法式气质温柔,宁莎旗舰店,https://detail.tmall.com/item.htm?id=706465824317&ns=1&abbucket=0
32.82,taobao,670012135639,大码胖mm上衣春秋温柔风气质荷叶边V领长袖雪纺衬衫女套头绑带潮,时尚臻品靓店,https://item.taobao.com/item.htm?id=670012135639&ns=1&abbucket=0#detail
69.9,taobao,717376203204,多巴胺欧货夏小个子碎花喇叭袖衬衫女修身V领雪纺温柔超仙上衣潮,网红爆款服装厂家企业店,https://item.taobao.com/item.htm?id=717376203204&ns=1&abbucket=0#detail
69.0,taobao,711299517543,重工蕾丝刺绣一字肩长袖衬衫女2023春新款减龄温柔风百搭别致上衣,Only You私人订制,https://item.taobao.com/item.htm?id=711299517543&ns=1&abbucket=0#detail
59.99,taobao,717689124324,亦！ 2023夏季时尚荷叶边气质温柔风盘扣国风短袖衬衫上衣女,橙子外贸品质女装,https://item.taobao.com/item.htm?id=717689124324&ns=1&abbucket=0#detail
