45.9,tmall,707441640224,法式高级感白色衬衫女小个子春秋2023新款设计感小众衬衣气质上衣,丽茹姗旗舰店,https://detail.tmall.com/item.htm?id=707441640224&ns=1&abbucket=0
49.9,tmall,708037694504,法式蓝色衬衫女外套春秋2023新款设计感小众衬衣冷淡系高级感上衣,丽茹姗旗舰店,https://detail.tmall.com/item.htm?id=708037694504&ns=1&abbucket=0
79.0,tmall,722139893144,白色刺绣正肩短袖衬衫女夏季设计感小众衬衣女款法式棉麻上衣夏款,巧娇雅旗舰店,https://detail.tmall.com/item.htm?id=722139893144&ns=1&abbucket=0
79.0,tmall,723886197374,法式绿色长袖防晒衬衫女夏季设计感小众亚麻衬衣外套棉麻上衣夏款,巧娇雅旗舰店,https://detail.tmall.com/item.htm?id=723886197374&ns=1&abbucket=0
79.0,tmall,719466243809,法式条纹防晒长袖衬衫女夏季薄款气质开衫小个子宽松棉麻上衣外套,婉扮旗舰店,https://detail.tmall.com/item.htm?id=719466243809&ns=1&abbucket=0
79.9,tmall,719814554963,法式温柔风白色衬衫女夏季设计感小众木耳边宽松娃娃衫泡泡袖上衣,千蓉宸旗舰店,https://detail.tmall.com/item.htm?id=719814554963&ns=1&abbucket=0
79.9,tmall,720509849412,白色中长款防晒衬衫女夏薄纱罩衫透视衬衣冰丝新中式盘扣外套上衣,优米黛旗舰店,https://detail.tmall.com/item.htm?id=720509849412&ns=1&abbucket=0
79.0,tmall,719279890953,法式绿色天丝防晒衬衫女夏小个子宽松开衫外套高级感棉麻衬衣上衣,婉扮旗舰店,https://detail.tmall.com/item.htm?id=719279890953&ns=1&abbucket=0
25.8,tmall,703927289978,娅丽娅蓝色防晒衬衫女春夏季中长款宽松长袖韩系薄款上衣温柔很仙,天天特卖工厂店,https://detail.tmall.com/item.htm?id=703927289978&ns=1&abbucket=0
79.01,taobao,671900475660,森马长袖衬衫女中长款雪纺2023夏季新款oversize开叉上衣温柔潮流,Semir森马品牌商城店,https://item.taobao.com/item.htm?id=671900475660&ns=1&abbucket=0#detail
56.0,taobao,722434014122,温柔风气质白色短袖衬衫夏季女新款设计感小个子初恋方领法式上衣,baby小菲工作室,https://item.taobao.com/item.htm?id=722434014122&ns=1&abbucket=0#detail
82.0,taobao,720093061644,法式温柔娃娃领衬衣春夏季设计感小众蕾丝上衣女长袖衬衫雪纺小衫,CHENCHEN 陈陈家,https://item.taobao.com/item.htm?id=720093061644&ns=1&abbucket=0#detail
79.0,tmall,721907209187,法式白色小飞袖正肩polo领衬衫女夏季薄款宽松显瘦设计感小众上衣,珂茹旗舰店,https://detail.tmall.com/item.htm?id=721907209187&ns=1&abbucket=0
79.9,taobao,725405135170,温柔风法式别致长袖衬衫女2023夏季新款不规则设计感白色防晒小衫,蓝莓的小衣橱,https://item.taobao.com/item.htm?id=725405135170&ns=1&abbucket=0#detail
78.0,tmall,722920221226,港风别致蓝色娃娃领薄款衬衫女夏设计感小众法式短袖衬衣温柔上衣,别致的安妮旗舰店,https://detail.tmall.com/item.htm?id=722920221226&ns=1&abbucket=0
79.0,tmall,720762982617,法式甜美露肩上衣女夏季小个子设计感小众绿色温柔系别致绝美衬衫,绮雨薇旗舰店,https://detail.tmall.com/item.htm?id=720762982617&ns=1&abbucket=0
59.9,tmall,703911114643,法式温柔长袖衬衫女春秋款2023新款高级感韩系衬衣上衣小众设计感,y6y旗舰店,https://detail.tmall.com/item.htm?id=703911114643&ns=1&abbucket=0
59.9,tmall,705268344742,法式独特别致娃娃衫荷叶边衬衫上衣女春秋2023新款设计感小众衬衣,加迪波尔旗舰店,https://detail.tmall.com/item.htm?id=705268344742&ns=1&abbucket=0
69.0,tmall,720556397788,灰色天丝防晒衬衫外套女夏季薄款法式开衫外搭衬衣小个子雪纺上衣,辉婵旗舰店,https://detail.tmall.com/item.htm?id=720556397788&ns=1&abbucket=0
16.98,taobao,681906604306,防衬衫女夏季系设计感小众中长薄款开衫外套晒长袖早秋韩温柔上衣,from beginning 初始,https://item.taobao.com/item.htm?id=681906604306&ns=1&abbucket=0#detail
59.0,taobao,719975042271,宫廷风小个子温柔蕾丝泡泡袖衬衣女夏季宽松显瘦短袖衬衫甜美上衣,XIAOXIAO晓晓家,https://item.taobao.com/item.htm?id=719975042271&ns=1&abbucket=0#detail
44.68,taobao,723776704184,设计感小众韩版温柔甜美气质衬衫女夏季设计感刺绣上衣法式泡泡袖,壹号人家女装,https://item.taobao.com/item.htm?id=723776704184&ns=1&abbucket=0#detail
45.98,taobao,722286606007,法式甜美一字领珍珠吊带衬衫女夏季甜美宽松娃娃衫温柔风雪纺上衣,拾柒同学,https://item.taobao.com/item.htm?id=722286606007&ns=1&abbucket=0#detail
69.9,tmall,723514782915,中长款白色衬衫女夏薄纱罩衫防晒开衫遮屁股外套衬衣冰丝透视上衣,优米黛旗舰店,https://detail.tmall.com/item.htm?id=723514782915&ns=1&abbucket=0
29.98,taobao,720050520475,温柔系穿搭Polo领小个子短袖衬衫女夏季宽松显瘦防晒衫外套ins潮,CUIHUA COMING翠花来了潮牌店,https://item.taobao.com/item.htm?id=720050520475&ns=1&abbucket=0#detail
66.8,taobao,723361579250,正肩方领碎花短袖衬衫女大码夏季胖MM法式设计感显瘦温柔雪纺上衣,MOMO高定大码女装,https://item.taobao.com/item.htm?id=723361579250&ns=1&abbucket=0#detail
69.0,tmall,722756705929,法式甜美碎花刺绣短袖上衣女夏季小个子设计感小众温柔系初恋衬衫,绮雨薇旗舰店,https://detail.tmall.com/item.htm?id=722756705929&ns=1&abbucket=0
59.9,tmall,720325626359,法式甜美气质碎花衬衫女夏季温柔系凡尔赛设计感收腰显瘦方领上衣,然说旗舰店,https://detail.tmall.com/item.htm?id=720325626359&ns=1&abbucket=0
69.98,taobao,724390370186,YOYO CLUB大码法式v领衬衫女夏季2023新款泡泡袖抽褶遮肚显瘦上衣,YOYO CLUB,https://item.taobao.com/item.htm?id=724390370186&ns=1&abbucket=0#detail
37.98,taobao,724576906760,粉色小个子娃娃领短袖衬衫女设计感两面穿夏季新款温柔风甜美上衣,Ele classm十一同学,https://item.taobao.com/item.htm?id=724576906760&ns=1&abbucket=0#detail
36.9,tmall,716072196444,宽松防晒衬衫2023新款夏季薄款外套女设计感小众百搭白色衬衣开衫,草子木衣旗舰店,https://detail.tmall.com/item.htm?id=716072196444&ns=1&abbucket=0
20.9,taobao,719664481850,御姐风秘书性感纯欲夏天上衣衬衣套装jk制服修身ol职业白衬衫女夏,情趣阁 隐私发货,https://item.taobao.com/item.htm?id=719664481850&ns=1&abbucket=0#detail
89.0,taobao,720706622967,清新飘逸蓝色温柔气质长袖衬衫女夏装韩版宽松显瘦百搭通勤上衣潮,Ershijiu 二十九,https://item.taobao.com/item.htm?id=720706622967&ns=1&abbucket=0#detail
17.99,taobao,670730881458,夏季女装批新款发温柔百搭宽松大码学生衬衣短袖休闲清新碎花衬衫,世界大美人女装批发,https://item.taobao.com/item.htm?id=670730881458&ns=1&abbucket=0#detail
69.0,tmall,723998378399,粉色泡泡袖蝴蝶结短袖衬衫女夏季高级感宽松衬衣小个子Polo衫上衣,浪曼樱娜旗舰店,https://detail.tmall.com/item.htm?id=723998378399&ns=1&abbucket=0
79.0,tmall,714733973029,粉色雪纺防晒衬衫女夏夏季薄款法式长袖衬衣外套肌理感中长款上衣,辉婵旗舰店,https://detail.tmall.com/item.htm?id=714733973029&ns=1&abbucket=0
58.0,tmall,718248644622,衬衫短裤套装学院风两件套小个子温柔系凡尔赛短袖法式上衣女夏款,樱丽诗旗舰店,https://detail.tmall.com/item.htm?id=718248644622&ns=1&abbucket=0
68.0,tmall,718600500776,法式v领七分袖防晒衬衫女夏夏季薄款短袖衬衣宽松小个子别致上衣,淘米迪旗舰店,https://detail.tmall.com/item.htm?id=718600500776&ns=1&abbucket=0
59.8,tmall,720558410528,高级感别致独特上衣女设计感小众夏季韩系温柔风防晒长袖衬衫外套,芯娇晴旗舰店,https://detail.tmall.com/item.htm?id=720558410528&ns=1&abbucket=0
36.99,taobao,674688288002,温柔风文艺少女超仙法式小众上衣女夏气质白衬衫短袖宽松韩版衬衣,偶遇猫小姐 清新文艺女装,https://item.taobao.com/item.htm?id=674688288002&ns=1&abbucket=0#detail
68.0,tmall,674209523626,法式温柔风薄荷绿短袖衬衫女设计感小众夏季薄款衬衣通勤别致上衣,淘米迪旗舰店,https://detail.tmall.com/item.htm?id=674209523626&ns=1&abbucket=0
69.8,tmall,680432073945,2023春秋新款娃娃领法式内搭打底长袖衬衫女设计感小众温柔风上衣,赛尔摩旗舰店,https://detail.tmall.com/item.htm?id=680432073945&ns=1&abbucket=0
79.9,tmall,720327445546,中长款格子防晒衬衫女夏欧货大版多巴胺薄纱冰丝开衫衬衣外套上衣,维菲萨旗舰店,https://detail.tmall.com/item.htm?id=720327445546&ns=1&abbucket=0
69.68,tmall,718877384003,法式温柔风白色方领短袖衬衫女夏季设计感小众修身短款泡泡袖上衣,赛帛莉旗舰店,https://detail.tmall.com/item.htm?id=718877384003&ns=1&abbucket=0
49.9,tmall,724027089256,法式温柔系小个子粉色无袖衬衫女夏季2023新款衬衣上衣小众设计感,丽茹姗旗舰店,https://detail.tmall.com/item.htm?id=724027089256&ns=1&abbucket=0
49.9,tmall,719141719014,温柔白色小飞袖衬衫上衣女夏季2023新款小个子设计感小众法式衬衣,佩姿萱旗舰店,https://detail.tmall.com/item.htm?id=719141719014&ns=1&abbucket=0
137.52,tmall,651647471638,凡兔2023春季新款内搭衬衣长袖雪纺白色衬衫女高级法式设计感上衣,onet凡兔旗舰店,https://detail.tmall.com/item.htm?id=651647471638&ns=1&abbucket=0
78.88,tmall,677663301753,无性别vintage衬衫宽松慵懒垂质感冰丝长袖雪纺衫日系jk衬衣女夏,惠纽旗舰店,https://detail.tmall.com/item.htm?id=677663301753&ns=1&abbucket=0
138.0,taobao,643381676778,JACOOBS烟蓝色雪纺飘带短袖衬衫女夏垂感职业正装OL通勤面试套装,JACOOBS STUDIO 娅可家,https://item.taobao.com/item.htm?id=643381676778&ns=1&abbucket=0#detail
59.0,tmall,707582001073,法式条纹polo领短袖衬衫女夏夏季复古港风盐系衬衣设计感小众上衣,淘米迪旗舰店,https://detail.tmall.com/item.htm?id=707582001073&ns=1&abbucket=0
139.0,taobao,646854712422,ACHU 一见倾心 蓝色缎面衬衫女职业通勤OL面试衬衣设计感上衣轻熟,ACHU 阿初,https://item.taobao.com/item.htm?id=646854712422&ns=1&abbucket=0#detail
32.8,taobao,706170442762,长袖衬衫女2023新款设计感小众蓝色条纹法式上衣夏季防晒衬衣外套,CUIHUA COMING翠花来了潮牌店,https://item.taobao.com/item.htm?id=706170442762&ns=1&abbucket=0#detail
78.0,tmall,643007451507,夏季高级感七分袖职业白衬衫女春秋缎面长袖衬衣气质面试正装上衣,世金秀旗舰店,https://detail.tmall.com/item.htm?id=643007451507&ns=1&abbucket=0
29.97,taobao,669576165437,法式蝴蝶结衬衫女设计感小众2023年新款春季别致高级感长袖上衣服,小新家 每天上新,https://item.taobao.com/item.htm?id=669576165437&ns=1&abbucket=0#detail
139.0,tmall,643085954370,春夏新款衬衣职业雪纺白色短袖衬衫女士设计感上衣薄款防晒衣,巷子里的话语旗舰店,https://detail.tmall.com/item.htm?id=643085954370&ns=1&abbucket=0
41.9,tmall,724253620466,法式别致漂亮白色立领短袖衬衫女装夏季设计感小众小飞袖气质上衣,cenzcci旗舰店,https://detail.tmall.com/item.htm?id=724253620466&ns=1&abbucket=0
45.9,tmall,707367694836,2023新款防晒蓝色衬衫女夏季薄款设计感小众法式衬衣长袖chic上衣,y6y旗舰店,https://detail.tmall.com/item.htm?id=707367694836&ns=1&abbucket=0
49.9,tmall,694176256095,美式重磅长袖衬衫女秋季宽松高级感纯棉寸衫纯色白色翻领衬衣外套,天天特卖工厂店,https://detail.tmall.com/item.htm?id=694176256095&ns=1&abbucket=0
45.9,tmall,705202434824,高级感女士衬衫女春季2023年新款设计感小众衬衣法式雪纺别致上衣,y6y旗舰店,https://detail.tmall.com/item.htm?id=705202434824&ns=1&abbucket=0
29.9,tmall,714045532504,大码胖mm防晒衬衫女夏季新款薄款开衫外套长袖韩系温柔风外搭上衣,天天特卖工厂店,https://detail.tmall.com/item.htm?id=714045532504&ns=1&abbucket=0
59.0,tmall,723800082153,粉色泡泡短袖圆领衬衫女夏季新款法式复古甜美娃娃衫洋气温柔上衣,赐律旗舰店,https://detail.tmall.com/item.htm?id=723800082153&ns=1&abbucket=0
79.0,tmall,679298810864,法式棉麻防晒衬衫外套女夏季薄款慵懒宽松衬衣空调衫吊带外搭上衣,圆雅旗舰店,https://detail.tmall.com/item.htm?id=679298810864&ns=1&abbucket=0
59.9,tmall,710426184897,法式小香风v领荷叶边雪纺衬衫女夏季薄款设计感小众轻熟上衣衬衣,zenpp旗舰店,https://detail.tmall.com/item.htm?id=710426184897&ns=1&abbucket=0
69.9,tmall,676571617586,韩系温柔纯棉短袖衬衫女夏季新款设计感小众蕾丝花边宽松白色上衣,proemio旗舰店,https://detail.tmall.com/item.htm?id=676571617586&ns=1&abbucket=0
65.0,tmall,710618094618,夏装2023新款衬衫两件套洋气独特气质浪漫复古穿搭短袖法式上衣女,樱丽诗旗舰店,https://detail.tmall.com/item.htm?id=710618094618&ns=1&abbucket=0
39.9,tmall,707366629449,chic短袖白色雪纺衬衫上衣女新款法式温柔设计感小众衬衣夏季防晒,苏朵娅服饰旗舰店,https://detail.tmall.com/item.htm?id=707366629449&ns=1&abbucket=0
59.9,tmall,705773766504,法式独特荷叶边衬衫衬衣女早春季2023新款设计感小众温柔长袖上衣,佩姿萱旗舰店,https://detail.tmall.com/item.htm?id=705773766504&ns=1&abbucket=0
39.98,taobao,717178804680,夏季2023年新款绿色小个子衬衫韩系女甜美温柔法式设计感短袖衬衣,小宅女大购物 xiaozhainv 小宅女家 xiao zhai nv,https://item.taobao.com/item.htm?id=717178804680&ns=1&abbucket=0#detail
109.0,tmall,704349786294,法式独特别致小上衣V领荷叶边雪纺衫2023春夏碎花衬衫设计感小众,怡宝芬旗舰店,https://detail.tmall.com/item.htm?id=704349786294&ns=1&abbucket=0
242.1,tmall,711697542351,范思蓝恩23FS12155 法式气质短袖衬衫女夏季2023新款上衣温柔甜美,范思蓝恩旗舰店,https://detail.tmall.com/item.htm?id=711697542351&ns=1&abbucket=0
76.0,tmall,642374290011,2023年夏季新款奶油黄短袖衬衫法式温柔设计感小众别致薄款上衣女,悦在旗舰店,https://detail.tmall.com/item.htm?id=642374290011&ns=1&abbucket=0
49.9,tmall,671331768930,夏季2023年新款蓝色POLO领衬衫女短袖韩版宽松上衣设计感小众百搭,赛尔摩旗舰店,https://detail.tmall.com/item.htm?id=671331768930&ns=1&abbucket=0
59.9,tmall,680432372229,2023年新款法式衬衣内搭设计感小众森系防晒格子衬衫外套女春秋季,卡拉尔贝齐旗舰店,https://detail.tmall.com/item.htm?id=680432372229&ns=1&abbucket=0
48.0,tmall,676093675953,短袖衬衫女高级宽松oversize港风亚麻半袖衬衣夏季韩版大码外套潮,森素旗舰店,https://detail.tmall.com/item.htm?id=676093675953&ns=1&abbucket=0
59.0,tmall,711058080132,小清新白色短袖衬衫女2023夏季新款设计感小众温柔气质减龄上衣潮,慕妞旗舰店,https://detail.tmall.com/item.htm?id=711058080132&ns=1&abbucket=0
49.8,tmall,644760149523,甜美白色衬衫女设计感小众2023夏季新款花朵短袖衬衣减龄纯棉上衣,慕妞旗舰店,https://detail.tmall.com/item.htm?id=644760149523&ns=1&abbucket=0
79.0,tmall,677920681879,雪纺白色衬衫女2023年春装新款设计感小众打底长袖西装领职业上衣,诺曼芬女装旗舰店,https://detail.tmall.com/item.htm?id=677920681879&ns=1&abbucket=0
59.0,taobao,646280945208,逃离地球大鹅满印衬衫女夏垂感宽松慵懒风美式复古短袖上衣ins潮,逃离地球 情报局,https://item.taobao.com/item.htm?id=646280945208&ns=1&abbucket=0#detail
39.9,tmall,698912353279,条纹衬衫2023夏季独特别致衬衣女设计感小众外套法式气质上衣薄款,beautymark飚美旗舰店,https://detail.tmall.com/item.htm?id=698912353279&ns=1&abbucket=0
39.0,tmall,653367370312,秋季冰丝衬衫男女长袖内搭免烫宽松休闲痞帅纯色百搭学生情侣衬衣,daftpunk疯庞克旗舰店,https://detail.tmall.com/item.htm?id=653367370312&ns=1&abbucket=0
89.99,tmall,703426220522,森马中袖衬衫女中长款宽松慵懒休闲甜系夏肌理格子衬衣复古小清新,森马官方旗舰店,https://detail.tmall.com/item.htm?id=703426220522&ns=1&abbucket=0
129.0,taobao,647258769065,ACHU 率性简约 高级感绿色缎面衬衫女职业面试衬衣设计感小众上衣,ACHU 阿初,https://item.taobao.com/item.htm?id=647258769065&ns=1&abbucket=0#detail
122.55,tmall,713736585194,原水2023夏季新款法式绿色短袖衬衫女夏温柔系凡尔赛别致气质上衣,原水旗舰店,https://detail.tmall.com/item.htm?id=713736585194&ns=1&abbucket=0
68.0,tmall,673988663945,夏装垂坠感气质缎面五分袖白衬衫女2023女装翻领职业通勤短袖上衣,本凡印象旗舰店,https://detail.tmall.com/item.htm?id=673988663945&ns=1&abbucket=0
76.0,tmall,708520790631,温柔韩系蕾丝花边圆领短袖衬衫女夏季新款独特压褶设计感宽松小衫,悦在旗舰店,https://detail.tmall.com/item.htm?id=708520790631&ns=1&abbucket=0
49.9,tmall,673968729733,慕兔小清新扎染印花短袖衬衫女2023年夏季新款港风设计感小众上衣,慕兔旗舰店,https://detail.tmall.com/item.htm?id=673968729733&ns=1&abbucket=0
59.9,tmall,672237117684,2023夏季新款温柔风韩系甜美仙女法式上衣设计感小众短袖白色衬衫,赛尔摩旗舰店,https://detail.tmall.com/item.htm?id=672237117684&ns=1&abbucket=0
59.9,taobao,673635290197,白色雪纺衬衫女短袖夏西装领职业正装长袖春秋通勤面试白衬衣上衣,子西ZIXI,https://item.taobao.com/item.htm?id=673635290197&ns=1&abbucket=0#detail
59.9,tmall,670239060646,慕兔ins港风宽松高级感花衬衫女2023夏新款设计感小众短袖上衣潮,慕兔旗舰店,https://detail.tmall.com/item.htm?id=670239060646&ns=1&abbucket=0
49.9,tmall,675771623430,白色短袖衬衫女夏季2023年新款法式衬衣高级感穿搭小个子半袖上衣,森瓦旗舰店,https://detail.tmall.com/item.htm?id=675771623430&ns=1&abbucket=0
46.98,taobao,714788138057,香芋紫短袖衬衫女夏新款设计感小众衬衣温柔风甜美韩系上衣小个,月牙城,https://item.taobao.com/item.htm?id=714788138057&ns=1&abbucket=0#detail
68.0,tmall,718600500776,法式v领七分袖防晒衬衫女夏夏季薄款短袖衬衣宽松小个子别致上衣,淘米迪旗舰店,https://detail.tmall.com/item.htm?id=718600500776&ns=1&abbucket=0
79.01,taobao,671900475660,森马长袖衬衫女中长款雪纺2023夏季新款oversize开叉上衣温柔潮流,Semir森马品牌商城店,https://item.taobao.com/item.htm?id=671900475660&ns=1&abbucket=0#detail
79.0,tmall,719279890953,法式绿色天丝防晒衬衫女夏小个子宽松开衫外套高级感棉麻衬衣上衣,婉扮旗舰店,https://detail.tmall.com/item.htm?id=719279890953&ns=1&abbucket=0
38.8,tmall,720012415526,法式高级感减龄花朵短袖衬衫女夏季温柔风穿搭气质百搭小个子上衣,LPQFC旗舰店,https://detail.tmall.com/item.htm?id=720012415526&ns=1&abbucket=0
28.6,taobao,721201060679,夏季2023年法式温柔风后背蝴蝶结设计小众海边度假防晒衬衫女装,霏霏精品服装店,https://item.taobao.com/item.htm?id=721201060679&ns=1&abbucket=0#detail
49.0,tmall,718605576220,奶黄色长袖衬衫女夏季薄款冰丝防晒外套2023新款chic韩系温柔上衣,潮美臣旗舰店,https://detail.tmall.com/item.htm?id=718605576220&ns=1&abbucket=0
32.9,tmall,717956212714,奶系黄色短袖衬衫女小个子法式别致上衣女夏2023新款甜美日系衬衣,草子木衣旗舰店,https://detail.tmall.com/item.htm?id=717956212714&ns=1&abbucket=0
39.28,taobao,718991839721,法式泡泡袖衬衫女装夏季2023新款衬衣温柔风气质方领锁骨别致上衣,少女的梦衣舍,https://item.taobao.com/item.htm?id=718991839721&ns=1&abbucket=0#detail
69.0,tmall,722435285287,法式粉色尖领雪纺短袖衬衫女夏季冰丝泡泡袖短款上衣天丝甜美小衫,梦玉人旗舰店,https://detail.tmall.com/item.htm?id=722435285287&ns=1&abbucket=0
49.9,tmall,675802711036,防晒衬衫女夏季设计感小众外搭薄款慵懒风法式上衣温柔系衬衣外套,优森友旗舰店,https://detail.tmall.com/item.htm?id=675802711036&ns=1&abbucket=0
69.9,tmall,723514782915,中长款白色衬衫女夏薄纱罩衫防晒开衫遮屁股外套衬衣冰丝透视上衣,优米黛旗舰店,https://detail.tmall.com/item.htm?id=723514782915&ns=1&abbucket=0
79.0,tmall,714733973029,粉色雪纺防晒衬衫女夏夏季薄款法式长袖衬衣外套肌理感中长款上衣,辉婵旗舰店,https://detail.tmall.com/item.htm?id=714733973029&ns=1&abbucket=0
59.0,tmall,700973528391,2023早春季新款又甜又辣短款白色衬衫女成熟气质女神范高级感上衣,饰宇旗舰店,https://detail.tmall.com/item.htm?id=700973528391&ns=1&abbucket=0
57.8,taobao,722971330948,大码女装法式温柔方领泡泡袖雪纺上衣夏季胖MM遮肚子显瘦短袖衬衫,MOMO高定大码女装,https://item.taobao.com/item.htm?id=722971330948&ns=1&abbucket=0#detail
59.8,tmall,720558410528,高级感别致独特上衣女设计感小众夏季韩系温柔风防晒长袖衬衫外套,芯娇晴旗舰店,https://detail.tmall.com/item.htm?id=720558410528&ns=1&abbucket=0
74.0,taobao,722454727542,粉色棉麻防晒衬衫女夏季薄款Polo领温柔甜美减龄气质亚麻上衣外套,MoonNa 月亮娜娜,https://item.taobao.com/item.htm?id=722454727542&ns=1&abbucket=0#detail
59.0,tmall,724678930593,蝴蝶结飘带粉色衬衫女士高级感珠光温柔雪纺短袖上衣夏季法式衬衣,苏兰韵旗舰店,https://detail.tmall.com/item.htm?id=724678930593&ns=1&abbucket=0
25.8,tmall,703927289978,娅丽娅蓝色防晒衬衫女春夏季中长款宽松长袖韩系薄款上衣温柔很仙,天天特卖工厂店,https://detail.tmall.com/item.htm?id=703927289978&ns=1&abbucket=0
49.9,tmall,724027089256,法式温柔系小个子粉色无袖衬衫女夏季2023新款衬衣上衣小众设计感,丽茹姗旗舰店,https://detail.tmall.com/item.htm?id=724027089256&ns=1&abbucket=0
79.0,tmall,721012740531,粉色天丝防晒衬衫女夏季小个子薄款开衫外套棉麻衬衣法式上衣夏款,巧娇雅旗舰店,https://detail.tmall.com/item.htm?id=721012740531&ns=1&abbucket=0
58.98,taobao,724040036814,HOYANXI大码女装甜美雪纺短袖衬衫夏季温柔风泡泡袖抽绳短款上衣,洪阳喜HOYANXI,https://item.taobao.com/item.htm?id=724040036814&ns=1&abbucket=0#detail
69.9,tmall,722239825839,中长款镂空防晒衬衫外套女夏薄纱外搭衬衣波西米亚民族风冰丝上衣,优米黛旗舰店,https://detail.tmall.com/item.htm?id=722239825839&ns=1&abbucket=0
79.0,tmall,718589436184,白色刺绣正肩短袖衬衫女夏季设计感小众棉麻防晒衬衣夏款法式上衣,巧娇雅旗舰店,https://detail.tmall.com/item.htm?id=718589436184&ns=1&abbucket=0
68.0,tmall,674209523626,法式温柔风薄荷绿短袖衬衫女设计感小众夏季薄款衬衣通勤别致上衣,淘米迪旗舰店,https://detail.tmall.com/item.htm?id=674209523626&ns=1&abbucket=0
20.9,taobao,719664481850,御姐风秘书性感纯欲夏天上衣衬衣套装jk制服修身ol职业白衬衫女夏,情趣阁 隐私发货,https://item.taobao.com/item.htm?id=719664481850&ns=1&abbucket=0#detail
59.9,tmall,718151979264,高级感雪纺防嗮衬衣衬衫女夏季2023新款韩系温柔绝美气质小衫上衣,mariecoco旗舰店,https://detail.tmall.com/item.htm?id=718151979264&ns=1&abbucket=0
49.9,tmall,724038183363,2023新款法式气质短袖衬衫女夏季温柔甜美简约时尚宽松衬衫女,欣善美旗舰店,https://detail.tmall.com/item.htm?id=724038183363&ns=1&abbucket=0
58.0,taobao,705600569669,ANAMONE 港味复古短袖花衬衫女2023夏季新款温柔风日系高级感泰式,ANAMONE STUDIO,https://item.taobao.com/item.htm?id=705600569669&ns=1&abbucket=0#detail
59.8,taobao,702626453365,捡漏！法式木耳边蝴蝶结雪纺衬衫女设计感小众温柔风洋气衬衣,小乐子女装,https://item.taobao.com/item.htm?id=702626453365&ns=1&abbucket=0#detail
89.0,taobao,718499798856,法式白色防晒衬衫女夏薄款中长款宽松外套外搭温柔风性感开衫衬衣,名媛风 OOTD STUDIO,https://item.taobao.com/item.htm?id=718499798856&ns=1&abbucket=0#detail
29.8,tmall,714130677372,防晒薄荷绿衬衫女夏季2023年新款微胖mm遮肉穿搭今年流行雪纺上衣,古嘉芙旗舰店,https://detail.tmall.com/item.htm?id=714130677372&ns=1&abbucket=0
69.0,tmall,723998378399,粉色泡泡袖蝴蝶结短袖衬衫女夏季高级感宽松衬衣小个子Polo衫上衣,浪曼樱娜旗舰店,https://detail.tmall.com/item.htm?id=723998378399&ns=1&abbucket=0
79.0,tmall,721907209187,法式白色小飞袖正肩polo领衬衫女夏季薄款宽松显瘦设计感小众上衣,珂茹旗舰店,https://detail.tmall.com/item.htm?id=721907209187&ns=1&abbucket=0
79.9,tmall,720327445546,中长款格子防晒衬衫女夏欧货大版多巴胺薄纱冰丝开衫衬衣外套上衣,维菲萨旗舰店,https://detail.tmall.com/item.htm?id=720327445546&ns=1&abbucket=0
42.98,taobao,718704900542,温柔风花边方领短袖衬衫女2023夏季新款宽松显瘦衬衣小个子上衣服,小宅妮时尚女装,https://item.taobao.com/item.htm?id=718704900542&ns=1&abbucket=0#detail
55.0,taobao,718906423491,温柔甜美气质碎花衬衫女夏七分袖衬衣复古港味田园风双层棉纱上衣,萝娜猫文艺清新女装,https://item.taobao.com/item.htm?id=718906423491&ns=1&abbucket=0#detail
69.0,tmall,705124459166,法式木耳边蝴蝶结雪纺衬衫女2023春新款设计感小众温柔风洋气衬衣,tvxk旗舰店,https://detail.tmall.com/item.htm?id=705124459166&ns=1&abbucket=0
