119.0,taobao,702859131993,摩登mdeng197设计感小众衬衫女2023春复古温柔减龄褶皱上衣52082,小杨家 十三行女装批发,https://item.taobao.com/item.htm?id=702859131993&ns=1&abbucket=0#detail
66.0,taobao,701743182457,纯欲法式衬衫女设计感小众喇叭袖春季温柔风甜美木耳边上衣,岱琪儿服装,https://item.taobao.com/item.htm?id=701743182457&ns=1&abbucket=0#detail
45.0,taobao,674501174605,很仙港风法式衬衫女夏装2023新款温柔轻熟风碎花衬衣复古短袖上衣,南柚家潮流女装,https://item.taobao.com/item.htm?id=674501174605&ns=1&abbucket=0#detail
59.0,tmall,720334517654,绿色短袖棉麻polo领衬衫女2023夏季设计感小众职业小个子亚麻上衣,彤婴娅旗舰店,https://detail.tmall.com/item.htm?id=720334517654&ns=1&abbucket=0
49.8,taobao,717462223953,温柔风复古高级感洋气气质短袖V领短款蕾丝花边别致衬衫上衣女夏,小郑家的店,https://item.taobao.com/item.htm?id=717462223953&ns=1&abbucket=0#detail
58.8,tmall,717786439944,法式温柔别致小衫荷叶边碎花短袖衬衫女夏季超仙泡泡袖设计感上衣,米贝娅旗舰店,https://detail.tmall.com/item.htm?id=717786439944&ns=1&abbucket=0
79.0,tmall,706001474242,法式白色中长款衬衫女春秋款别致纯棉宽松圆领衬衣设计感小众上衣,婉扮旗舰店,https://detail.tmall.com/item.htm?id=706001474242&ns=1&abbucket=0
158.0,tmall,715555350035,新中式碎花衬衫女夏季泡泡袖衬衣高级设计感小众小个子温柔系上衣,桃臻旗舰店,https://detail.tmall.com/item.htm?id=715555350035&ns=1&abbucket=0
69.9,tmall,725046138457,时尚气质百搭纯色方领衬衫女2023夏新款设计感小众温柔风显瘦上衣,丹来鸟旗舰店,https://detail.tmall.com/item.htm?id=725046138457&ns=1&abbucket=0
148.0,tmall,715400620569,白色新中式轻国风盘扣泡泡袖衬衫女夏季短袖T恤温柔茶系气质上衣,沁舒妍旗舰店,https://detail.tmall.com/item.htm?id=715400620569&ns=1&abbucket=0
79.0,taobao,638936514845,2023年夏季装新款设计感小众衬衣温柔韩版polo尖领蓝色长袖衬衫女,THREE 三七自制,https://item.taobao.com/item.htm?id=638936514845&ns=1&abbucket=0#detail
79.0,tmall,723834864413,韩版气质温柔v领泡泡袖衬衫女夏季洋气休闲减龄百搭显瘦短袖上衣,晨铃暮歌旗舰店,https://detail.tmall.com/item.htm?id=723834864413&ns=1&abbucket=0
79.0,tmall,725133618367,洋气减龄碎花刺绣短袖衬衫女夏季气质温柔百搭显瘦翻领正肩上衣薄,晨铃暮歌旗舰店,https://detail.tmall.com/item.htm?id=725133618367&ns=1&abbucket=0
75.0,tmall,724406672355,夏季短袖雪纺衬衫女夏装2023新款温柔风娃娃领别致刺绣上衣设计感,米陌服饰旗舰店,https://detail.tmall.com/item.htm?id=724406672355&ns=1&abbucket=0
79.8,tmall,706287229072,紫色温柔风v领长袖系带衬衫女春秋季设计感小众复古法式别致上衣,玖域阳旗舰店,https://detail.tmall.com/item.htm?id=706287229072&ns=1&abbucket=0
39.99,taobao,715402396919,大码黑色碎花衬衫女夏季胖mm法式衬衣显瘦温柔甜美一字肩上衣短款,胖小满大码女装,https://item.taobao.com/item.htm?id=715402396919&ns=1&abbucket=0#detail
39.9,taobao,676520449048,法式气质轻奢短袖衬衫女2022夏新款设计感小众高级感职业通勤衬衣,韩流依人坊,https://item.taobao.com/item.htm?id=676520449048&ns=1&abbucket=0#detail
63.0,taobao,683516357514,早秋装娃娃领温柔气质蕾丝衬衫女胖妹妹大码宽松显瘦休闲雪纺上衣,知名度 大码女装优衣馆,https://item.taobao.com/item.htm?id=683516357514&ns=1&abbucket=0#detail
79.8,tmall,706287229072,紫色温柔风v领长袖系带衬衫女春秋季设计感小众复古法式别致上衣,玖域阳旗舰店,https://detail.tmall.com/item.htm?id=706287229072&ns=1&abbucket=0
39.99,taobao,715402396919,大码黑色碎花衬衫女夏季胖mm法式衬衣显瘦温柔甜美一字肩上衣短款,胖小满大码女装,https://item.taobao.com/item.htm?id=715402396919&ns=1&abbucket=0#detail
39.9,taobao,676520449048,法式气质轻奢短袖衬衫女2022夏新款设计感小众高级感职业通勤衬衣,韩流依人坊,https://item.taobao.com/item.htm?id=676520449048&ns=1&abbucket=0#detail
63.0,taobao,683516357514,早秋装娃娃领温柔气质蕾丝衬衫女胖妹妹大码宽松显瘦休闲雪纺上衣,知名度 大码女装优衣馆,https://item.taobao.com/item.htm?id=683516357514&ns=1&abbucket=0#detail
79.0,tmall,703264642927,法式蕾丝刺绣温柔风衬衫女春秋2023新款提花优雅别致漂亮长袖上衣,纪蕊服饰旗舰店,https://detail.tmall.com/item.htm?id=703264642927&ns=1&abbucket=0
46.98,taobao,719125917085,泡泡袖方领短款上衣女装夏季设计感小众法式温柔超仙杏色短袖衬衫,左小姐来了,https://item.taobao.com/item.htm?id=719125917085&ns=1&abbucket=0#detail
65.0,taobao,724252804981,法式小众别致衬衫女夏季2023新款甜美宽松短袖衬衣温柔慵懒风上衣,寻见文艺复古女装,https://item.taobao.com/item.htm?id=724252804981&ns=1&abbucket=0#detail
54.99,taobao,711477360035,甜美减龄少女感温柔风！2023夏新款方领系带蝴蝶结百搭显瘦衬衫女,琪琪家优质外贸,https://item.taobao.com/item.htm?id=711477360035&ns=1&abbucket=0#detail
59.8,tmall,724496385312,法式温柔风衬衫女夏方领泡泡袖拼接别致娃娃衫设计感小众短款上衣,娅丽慕旗舰店,https://detail.tmall.com/item.htm?id=724496385312&ns=1&abbucket=0
48.8,taobao,626390437510,2022春秋新款粉色温柔风衬衫韩版复古港味长袖百搭宽松上衣女ins,Sweet girl 甜美女孩,https://item.taobao.com/item.htm?id=626390437510&ns=1&abbucket=0#detail
89.0,tmall,706596272673,白色圆领泡泡袖短袖衬衫女夏季新款小个子温柔减龄独特雪纺衫上衣,翊葭旗舰店,https://detail.tmall.com/item.htm?id=706596272673&ns=1&abbucket=0
47.98,taobao,722939760181,气质温柔别致褶皱无袖衬衫女夏季2023新款小众通勤单排扣翻领上衣,下架学姐XJXJ,https://item.taobao.com/item.htm?id=722939760181&ns=1&abbucket=0#detail
89.0,tmall,715145860496,绿色莱赛尔天丝防晒衬衫女夏季薄款开衫外套衬衣法式别致上衣夏款,巧娇雅旗舰店,https://detail.tmall.com/item.htm?id=715145860496&ns=1&abbucket=0
69.9,tmall,718135837409,复古碎花方领衬衫女2023夏季薄款小个子设计感泡泡短袖蕾丝上衣,INSCEC女装旗舰店,https://detail.tmall.com/item.htm?id=718135837409&ns=1&abbucket=0
59.0,taobao,639675105243,自制温柔风甜美粉色衬衫女ins法式小众设计感后开叉宽松慵懒衬衣,美小 文艺小清新,https://item.taobao.com/item.htm?id=639675105243&ns=1&abbucket=0#detail
59.0,taobao,722168139314,海边度假搭配防晒衣女开衫夏季2023新款法式温柔甜美长款雪纺衬衫,七彩鱼女装 坚持品质,https://item.taobao.com/item.htm?id=722168139314&ns=1&abbucket=0#detail
35.98,taobao,681000346298,法式甜美上衣女初秋设计感小众温柔韩系别致超仙内搭叠穿长袖衬衫,左小姐来了,https://item.taobao.com/item.htm?id=681000346298&ns=1&abbucket=0#detail
89.0,taobao,678500457942,白衬衫女春秋2023新款飘带上衣温柔感纯色长袖宽松设计感小众衬衣,ZIMO家 女装,https://item.taobao.com/item.htm?id=678500457942&ns=1&abbucket=0#detail
94.0,tmall,680773387115,假两件衬衫女早秋装2023今年新款小香风温柔气质洋气高端中长上衣,右帆旗舰店,https://detail.tmall.com/item.htm?id=680773387115&ns=1&abbucket=0
29.9,taobao,641594192687,盐系chic桔梗印花衬衫女夏港味复古温柔设计感小众原宿短袖衬衣潮,ALIN家 网红ins风,https://item.taobao.com/item.htm?id=641594192687&ns=1&abbucket=0#detail
68.0,tmall,674415129463,法式港风粉色尖领短袖衬衫衬衣女夏季宽松别致温柔设计感小众上衣,亚荷旗舰店,https://detail.tmall.com/item.htm?id=674415129463&ns=1&abbucket=0
110.0,taobao,701488493990,Sicily波点衬衫女2023春季新款设计感娃娃领长袖圆点温柔上班衬衣,陈本价 STUDIO,https://item.taobao.com/item.htm?id=701488493990&ns=1&abbucket=0#detail
59.9,tmall,723750806350,法式甜美黑白格子背带上衣女小清新温柔风夏季新款裙摆无袖衬衫衣,荟盈旗舰店,https://detail.tmall.com/item.htm?id=723750806350&ns=1&abbucket=0
69.0,tmall,712009621498,方领雪纺衬衫女夏季收腰甜美温柔娃娃衫设计感小众泡泡袖短袖衬衣,tvxk旗舰店,https://detail.tmall.com/item.htm?id=712009621498&ns=1&abbucket=0
88.0,taobao,717190588188,HAVE U韩系chic温柔别致休闲木耳花边拼接设计无袖衬衫上衣女夏季,The Lemon 柠檬绿茶,https://item.taobao.com/item.htm?id=717190588188&ns=1&abbucket=0#detail
49.99,taobao,700533938210,复古海军领结长袖衬衫女春秋季新款小清新温柔风显瘦休闲百搭上衣,拉窝姐姐,https://item.taobao.com/item.htm?id=700533938210&ns=1&abbucket=0#detail
40.98,taobao,680938025911,韩系宽松设计感小众白色衬衫女2023秋季新款温柔气质长袖条纹上衣,够百姓,https://item.taobao.com/item.htm?id=680938025911&ns=1&abbucket=0#detail
79.99,taobao,714627247992,温柔宫廷风褶皱雪纺上衣洋气V领显瘦长袖衬衫女春夏,菲凡外贸 菲凡家 高性价比优质原单,https://item.taobao.com/item.htm?id=714627247992&ns=1&abbucket=0#detail
79.0,tmall,706462425735,设计感小众挂脖V领真丝缎面衬衫女2023早春新款法式温柔气质上衣,YOUNGPINK旗舰店,https://detail.tmall.com/item.htm?id=706462425735&ns=1&abbucket=0
76.0,tmall,679572905781,飘带蝴蝶结衬衫女早秋2022新款设计感小众温柔气质长袖雪纺上衣,莲妲旗舰店,https://detail.tmall.com/item.htm?id=679572905781&ns=1&abbucket=0
98.0,taobao,654784174801,XinmonLee2023春秋季韩系ins风穿搭温柔小众设计感拼接修身衬衫女,XinMon Lee 李星梦,https://item.taobao.com/item.htm?id=654784174801&ns=1&abbucket=0#detail
62.0,taobao,706912048406,通勤气质温柔风法式缎面衬衫女春2023设计感抽褶显瘦短款雪纺上衣,迷恋上公主风格女装,https://item.taobao.com/item.htm?id=706912048406&ns=1&abbucket=0#detail
49.8,taobao,684171747042,法式小众V领上衣女2023早秋季新款温柔风气质飘带设计感别致衬衫,星海品牌女装店,https://item.taobao.com/item.htm?id=684171747042&ns=1&abbucket=0#detail
58.98,tmall,722276014471,uungchuu温柔方领泡泡袖衬衫女夏款一字肩上衣小个子显瘦短款小衫,RVU旗舰店,https://detail.tmall.com/item.htm?id=722276014471&ns=1&abbucket=0
65.0,taobao,722811028387,大码法式温柔风方领碎花短袖衬衫女装夏季微胖mm显瘦减龄气质上衣,子沐 大码轻奢定制,https://item.taobao.com/item.htm?id=722811028387&ns=1&abbucket=0#detail
79.0,taobao,722611551140,波点一字领法式短袖衬衣女韩系简约气质宽松显瘦百搭上衣夏季薄款,清阿柚Cherry,https://item.taobao.com/item.htm?id=722611551140&ns=1&abbucket=0#detail
59.0,tmall,685458483433,2022秋夏新款女设计感小众清新绿色雪纺衬衫法式娃娃领温柔风上衣,娴熙旗舰店,https://detail.tmall.com/item.htm?id=685458483433&ns=1&abbucket=0
46.9,taobao,722383572666,法式小众设计感温柔衬衫女夏季2023新款韩版别致压褶泡泡袖小衬衣,DIYI 小清新女装,https://item.taobao.com/item.htm?id=722383572666&ns=1&abbucket=0#detail
29.0,taobao,678409312724,微胖大码胖MM宽松显瘦温柔气质洋气百搭蝴蝶结白色雪纺长袖衬衫女,微微定制女装,https://item.taobao.com/item.htm?id=678409312724&ns=1&abbucket=0#detail
35.98,taobao,708704956799,韩国chic春季温柔百搭花边立领重工镂空钩花褶皱感长袖衬衫上衣女,佛系少女和怪味少女,https://item.taobao.com/item.htm?id=708704956799&ns=1&abbucket=0#detail
69.0,taobao,717982269665,法式复古温柔风甜美洋气优雅蕾丝花边钩花衬衫泡泡袖上衣女短袖夏,粉式FENSHI STUDIO,https://item.taobao.com/item.htm?id=717982269665&ns=1&abbucket=0#detail
65.0,taobao,709287395508,笨笨家纯欲法式衬衫女设计感小众喇叭袖春季温柔风甜美木耳边上衣,囍囍定制女装,https://item.taobao.com/item.htm?id=709287395508&ns=1&abbucket=0#detail
59.99,taobao,675713500257,方领泡泡袖短款上衣女设计感小众法式甜美温柔风别致漂亮碎花小衫,么宁文艺甜美小清新,https://item.taobao.com/item.htm?id=675713500257&ns=1&abbucket=0#detail
83.0,taobao,707981235772,MISS法式chic温柔风双排扣方领短袖衬衫外套女夏季新款小香风上衣,大曼Damon,https://item.taobao.com/item.htm?id=707981235772&ns=1&abbucket=0#detail
33.9,taobao,724632885145,2023年夏新款短袖垂感抗皱衬衫设计感小众气质百搭上衣温柔衬衣女,YIXI依曦家女装,https://item.taobao.com/item.htm?id=724632885145&ns=1&abbucket=0#detail
99.0,taobao,721698610268,法式荷叶边上衣娃娃衫2023夏季女装少女风一字领温柔复古牛仔衬衫,TAAS 韩国女装小清新订制,https://item.taobao.com/item.htm?id=721698610268&ns=1&abbucket=0#detail
49.9,tmall,717185771971,中长款防晒衬衫女夏新中式国风开衫衬衣薄纱冰丝露背开叉外搭上衣,维菲萨旗舰店,https://detail.tmall.com/item.htm?id=717185771971&ns=1&abbucket=0
39.9,tmall,680898223075,早春装2023年新款白色条纹衬衫女港风时尚初春季上衣设计感高级潮,纽汇旗舰店,https://detail.tmall.com/item.htm?id=680898223075&ns=1&abbucket=0
79.0,taobao,688369015104,【现货】文艺风扎花奶油黄长袖衬衫女2022年秋温柔别致上衣,vintage candy 复古商店,https://item.taobao.com/item.htm?id=688369015104&ns=1&abbucket=0#detail
79.9,tmall,715370905049,中长款白色连帽衬衫女夏季薄纱防晒外搭开衫欧货大版透视冰丝上衣,优米黛旗舰店,https://detail.tmall.com/item.htm?id=715370905049&ns=1&abbucket=0
78.0,taobao,682225967127,温柔风褶皱工艺设计感衬衫女2023年春季新款薄款长袖V领气质上衣,方小雨Studio,https://item.taobao.com/item.htm?id=682225967127&ns=1&abbucket=0#detail
58.9,tmall,711107535027,温柔风韩系甜美气质半袖上衣女夏宽松盐系慵懒设计感小众半袖衬衫,翠香美旗舰店,https://detail.tmall.com/item.htm?id=711107535027&ns=1&abbucket=0
34.98,taobao,724358951879,法式圆领泡泡袖衬衫女夏季宽松显瘦娃娃衫衬衣温柔风上衣2023新款,家有猫酱,https://item.taobao.com/item.htm?id=724358951879&ns=1&abbucket=0#detail
79.0,taobao,719705477897,韩版甜美碎花衬衫女上衣2023夏季新款方领泡泡袖气质温柔短袖衬衣,小莉家杭州四季青实体批发欧韩女装,https://item.taobao.com/item.htm?id=719705477897&ns=1&abbucket=0#detail
218.0,tmall,712230346296,2023夏季新款高级感防晒衬衫女温柔风薄款长袖衬衣宽松百搭空调衫,云给旗舰店,https://detail.tmall.com/item.htm?id=712230346296&ns=1&abbucket=0
49.0,taobao,674482341888,吃绿色菜原创新中式盘扣短袖衬衫女春季温柔小众气质抹胸上衣套装,吃绿色菜,https://item.taobao.com/item.htm?id=674482341888&ns=1&abbucket=0#detail
49.9,taobao,720772496525,温柔风荷叶边方领衬衫上衣女2023夏季新款设计感小众洋气漂亮小衫,名香衣橱 高端定制,https://item.taobao.com/item.htm?id=720772496525&ns=1&abbucket=0#detail
38.98,tmall,668553068256,甜美韩系蕾丝衬衫女2023年新款春夏温柔风圆领洋气泡泡袖别致上衣,俏系旗舰店,https://detail.tmall.com/item.htm?id=668553068256&ns=1&abbucket=0
66.8,taobao,705030976445,韩国chic春季温柔香芋紫娃娃领宽松休闲百搭纯色泡泡袖衬衫上衣女,良良家 韩国chic女装定制,https://item.taobao.com/item.htm?id=705030976445&ns=1&abbucket=0#detail
99.0,taobao,722661246485,花栗鼠小姐 夏日花信 纯棉碎花短袖衬衫/连衣裙女小众一字肩上衣,木木穿搭,https://item.taobao.com/item.htm?id=722661246485&ns=1&abbucket=0#detail
58.0,taobao,707815090932,漂亮洋气小衫夏季法式温柔软奶蓝设计感独特别致上衣蕾丝刺绣衬衫,ByU 花花家高端定制,https://item.taobao.com/item.htm?id=707815090932&ns=1&abbucket=0#detail
59.9,tmall,641634798627,慕斯黄~法式温柔泡泡袖衬衫女夏薄款2023新款别致气质V领短袖上衣,淘米迪旗舰店,https://detail.tmall.com/item.htm?id=641634798627&ns=1&abbucket=0
65.0,taobao,651777685476,温柔风杏色雪纺衬衫女长袖系带v领套头衬衣职业OL韩版2021秋新款,素言轻奢女装studio,https://item.taobao.com/item.htm?id=651777685476&ns=1&abbucket=0#detail
99.0,taobao,709361137734,佧茜文中式V领衬衫女2023夏新款温柔风简约宽松短袖衬衣气质上衣,佧茜文outlets店,https://item.taobao.com/item.htm?id=709361137734&ns=1&abbucket=0#detail
109.0,taobao,712530390494,雪纺短袖衬衫上衣女温柔甜美减龄夏季2023新款韩版宽松娃娃领衬衣,虎牙犬牙,https://item.taobao.com/item.htm?id=712530390494&ns=1&abbucket=0#detail
29.8,taobao,708453612611,夏季甜美复古娃娃领JK衬衫学院风温柔短款别致百搭显瘦短袖上衣女,韩衣批发店,https://item.taobao.com/item.htm?id=708453612611&ns=1&abbucket=0#detail
59.0,taobao,720854600549,夏季薄款温柔风复古碎花一字领宽松显瘦衬衫女设计感短袖气质上衣,天天家衣橱,https://item.taobao.com/item.htm?id=720854600549&ns=1&abbucket=0#detail
79.9,tmall,720639553236,2023夏季新款小众法式设计感上衣女小个子温柔杏色泡泡袖碎花衬衫,殿遇旗舰店,https://detail.tmall.com/item.htm?id=720639553236&ns=1&abbucket=0
28.9,tmall,720052238676,别致漂亮小衫温柔风韩系甜美女士飞飞袖小众衬衫上衣夏季V领衬衣,女乔小姐旗舰店,https://detail.tmall.com/item.htm?id=720052238676&ns=1&abbucket=0
49.99,taobao,680841202110,法式荷叶边碎花小衫女雪纺衬衫装秋季别致漂亮收腰温柔上衣高级感,米粒时尚工作室,https://item.taobao.com/item.htm?id=680841202110&ns=1&abbucket=0#detail
113.0,tmall,673075820171,衬衫上衣女夏季新款设计感小众别致温柔系法式收腰长袖防晒两件套,苏帕萱旗舰店,https://detail.tmall.com/item.htm?id=673075820171&ns=1&abbucket=0
134.0,taobao,713711532594,法式温柔风方领天丝绣花短袖衬衫爱西里23夏季新款宽松显瘦上衣女,Micky art,https://item.taobao.com/item.htm?id=713711532594&ns=1&abbucket=0#detail
113.0,taobao,719486451997,7M元气粉色短袖衬衫女2023夏款宽松气质港风衬衣温柔雪纺垂感上衣,7MVEVE,https://item.taobao.com/item.htm?id=719486451997&ns=1&abbucket=0#detail
128.0,tmall,705372035614,谜秀法式温柔别致衬衫女2023春夏季新款女装百搭长袖娃娃领衬衣女,谜秀旗舰店,https://detail.tmall.com/item.htm?id=705372035614&ns=1&abbucket=0
69.98,taobao,711729517785,YOYO CLUB大码设计感复古盘扣方领短袖衬衫夏季新款小众短款上衣,YOYO CLUB,https://item.taobao.com/item.htm?id=711729517785&ns=1&abbucket=0#detail
89.0,taobao,707244103156,森系复古立领口绣花精致蕾丝衬衫少女温柔杏色内搭刺绣打底上衣,衣公馆 日系 软妹 森女风,https://item.taobao.com/item.htm?id=707244103156&ns=1&abbucket=0#detail
158.0,tmall,641979514732,早春款2023年新款设计感小众白色衬衫时尚衬衣法式温柔上衣女夏季,姿女阁旗舰店,https://detail.tmall.com/item.htm?id=641979514732&ns=1&abbucket=0
308.0,taobao,718721373740,甜美别致衬衫女士冬卓雅2023夏季新款温柔风镂空短袖减龄衬衣上衣,歌雅高端女装,https://item.taobao.com/item.htm?id=718721373740&ns=1&abbucket=0#detail
99.0,tmall,709942844749,韩版好看露肩性感POLO领衬衫女2023夏新款法式温柔设计感中袖上衣,曼盛乔旗舰店,https://detail.tmall.com/item.htm?id=709942844749&ns=1&abbucket=0
89.76,taobao,706700467005,安璃 ANLI 立体刺绣花边棉麻衬衫温柔甜美少女减龄上衣2023年新款,安璃 ANLI,https://item.taobao.com/item.htm?id=706700467005&ns=1&abbucket=0#detail
89.0,taobao,681725450530,法式温柔上衣早秋新款真丝白色衬衫女长袖设计高级感小众印花秋季,雅可真丝奥特莱斯店,https://item.taobao.com/item.htm?id=681725450530&ns=1&abbucket=0#detail
79.0,taobao,717646418235,甜美衬衫女夏季新款韩版穿搭温柔荷叶边V领钉钻气质无袖上衣短裙,FHLZ定制女装,https://item.taobao.com/item.htm?id=717646418235&ns=1&abbucket=0#detail
49.0,taobao,670846566020,盐系复古桔梗印花衬衫女夏港味chic温柔设计感原宿BF风半袖衬衣潮,MUMU STUIDO 原创定制,https://item.taobao.com/item.htm?id=670846566020&ns=1&abbucket=0#detail
59.8,taobao,718873250822,2023夏季新款气质温柔减龄时尚韩版蝴蝶结宽松百搭短袖衬衫上衣女,独魅衣都,https://item.taobao.com/item.htm?id=718873250822&ns=1&abbucket=0#detail
59.98,taobao,669751202689,法式设计感后背绑带蝴蝶结方领泡泡袖衬衫女短款温柔风白色上衣潮,KriSmile 萌小鹿专柜,https://item.taobao.com/item.htm?id=669751202689&ns=1&abbucket=0#detail
76.0,tmall,675686609232,法式polo领白色雪纺褶皱短袖衬衫女夏薄款防晒高级感温柔t恤上衣,涵紫琳旗舰店,https://detail.tmall.com/item.htm?id=675686609232&ns=1&abbucket=0
79.0,tmall,708358450993,高级感香芋紫色防晒衬衫女夏季设计感小众宽松衬衣开衫醋酸上衣薄,朵妃嫣旗舰店,https://detail.tmall.com/item.htm?id=708358450993&ns=1&abbucket=0
399.0,tmall,712103555439,NANING9 2023春夏新款韩版休闲宽松温柔度假长袖V领雪纺衬衫女,naning9旗舰店,https://detail.tmall.com/item.htm?id=712103555439&ns=1&abbucket=0
98.0,tmall,714151637609,设计感小众娃娃领温柔风白衬衫女夏季洋气减龄短袖法式木耳边上衣,瑷玛朵旗舰店,https://detail.tmall.com/item.htm?id=714151637609&ns=1&abbucket=0
63.0,taobao,714714448851,大码女纯欲辣妹一字肩泡泡袖衬衫夏季新款胖mm遮肉显瘦温柔风上衣,胖美美网红大码女装,https://item.taobao.com/item.htm?id=714714448851&ns=1&abbucket=0#detail
189.0,taobao,667346261923,cpaia茜派雅 2023SS系带肌理法式复古上衣女设计感小众温柔风小衫,Cpaia 茜派雅,https://item.taobao.com/item.htm?id=667346261923&ns=1&abbucket=0#detail
79.0,tmall,716978876616,泡泡袖上衣女短袖雪纺衬衫夏季新款2023法式设计小众别致独特衬衣,沙菲利旗舰店,https://detail.tmall.com/item.htm?id=716978876616&ns=1&abbucket=0
41.68,taobao,667178199198,防晒长袖衬衫上衣夏季2023年新款女士设计感小众开叉白色衬衣外套,壹号人家女装,https://item.taobao.com/item.htm?id=667178199198&ns=1&abbucket=0#detail
215.91,tmall,710564362054,对白莱赛尔天丝短袖衬衫女夏2023新款气质通勤木耳边高级白色上衣,对白旗舰店,https://detail.tmall.com/item.htm?id=710564362054&ns=1&abbucket=0
38.98,tmall,669231018253,早秋法式温柔上衣女2023年新款秋季内搭打底白衬衫设计感小众衬衣,俏系旗舰店,https://detail.tmall.com/item.htm?id=669231018253&ns=1&abbucket=0
50.92,tmall,673574177919,JW 真维斯女装纯棉宽松休闲衬衣 春夏 简约纯色女士短袖衬衫薄,真维斯官方outlets店,https://detail.tmall.com/item.htm?id=673574177919&ns=1&abbucket=0
69.9,tmall,723008017391,慕兔法式吊带背心上衣两件套装女2023夏季新款镂空设计感小众衬衫,慕兔旗舰店,https://detail.tmall.com/item.htm?id=723008017391&ns=1&abbucket=0
68.0,tmall,714591445959,小个子短袖女衬衫上衣设计感小众夏季宽松Polo领纯棉法式衬衣外套,森素旗舰店,https://detail.tmall.com/item.htm?id=714591445959&ns=1&abbucket=0
224.25,tmall,712171060351,【李一桐同款】茵曼自然凉·小凉衫气质短袖衬衣女2023夏衬衫上衣,茵曼旗舰店,https://detail.tmall.com/item.htm?id=712171060351&ns=1&abbucket=0
49.9,tmall,714332990321,白色娃娃领短袖衬衫女夏2023新款设计感小众衬衣小个子泡泡袖上衣,森瓦旗舰店,https://detail.tmall.com/item.htm?id=714332990321&ns=1&abbucket=0
39.98,tmall,703712570512,纯棉蓝色长袖衬衫女2023年新款春夏季衬衣Polo领打底设计感上衣服,俏系旗舰店,https://detail.tmall.com/item.htm?id=703712570512&ns=1&abbucket=0
49.8,tmall,675944924312,帛卡琪2022新款夏季短袖衬衫女设计感绣花衬衣学院风娃娃领上衣潮,帛卡琪旗舰店,https://detail.tmall.com/item.htm?id=675944924312&ns=1&abbucket=0
69.0,tmall,674701185380,设计感镂空格子蓝色衬衫女2022夏季薄款宽松灯笼袖外穿防晒衫上衣,本凡印象旗舰店,https://detail.tmall.com/item.htm?id=674701185380&ns=1&abbucket=0
215.1,taobao,710257570275,范思蓝恩薄透防晒衬衫女设计感小众2023夏装新款简约宽松长袖上衣,范思蓝恩,https://item.taobao.com/item.htm?id=710257570275&ns=1&abbucket=0#detail
52.98,tmall,709533080506,春秋新款白色长袖衬衣华尔缎衬衫职业面试装轻奢法式小众别致上衣,天天特卖工厂店,https://detail.tmall.com/item.htm?id=709533080506&ns=1&abbucket=0
55.0,taobao,678640963502,夏季新款方领碎花短袖衬衫女温柔别致小众娃娃衫泡泡袖短款上衣,蘑菇街原创女装,https://item.taobao.com/item.htm?id=678640963502&ns=1&abbucket=0#detail
59.31,tmall,641465171779,带领带短袖衬衫女夏宽松日系休闲学生学院风小个子纯棉上衣polo衫,谨黎旗舰店,https://detail.tmall.com/item.htm?id=641465171779&ns=1&abbucket=0
59.99,taobao,702313589042,白色衬衫外套女设计感小众衬衣春秋季2023新款小个子超仙长袖上衣,么宁文艺甜美小清新,https://item.taobao.com/item.htm?id=702313589042&ns=1&abbucket=0#detail
35.91,tmall,720046830535,法式缎面短袖白色衬衫女气质显瘦轻熟职业面试衬衣设计感免烫抗皱,天天特卖工厂店,https://detail.tmall.com/item.htm?id=720046830535&ns=1&abbucket=0
