35.98,taobao,719850144840,小飞袖无袖宽松衬衫女夏季2023新款设计感小众温柔风韩系减龄上衣,拾柒同学,https://item.taobao.com/item.htm?id=719850144840&ns=1&abbucket=0#detail
168.0,tmall,706553331862,法式小个子奶系温柔风上衣别致独特小众设计感白色垫肩衬衫女春夏,琳了旗舰店,https://detail.tmall.com/item.htm?id=706553331862&ns=1&abbucket=0
139.0,taobao,721101584278,WMMJ 法式泡泡袖温柔风一字肩雪纺上衣女高级感气质减龄短袖衬衫,WMMJ,https://item.taobao.com/item.htm?id=721101584278&ns=1&abbucket=0#detail
79.0,taobao,722460355060,法式小飞袖木耳边娃娃衫女夏季多巴胺甜美风蓝色衬衫无袖雪纺上衣,金蘑咕咕STUDIO自制,https://item.taobao.com/item.htm?id=722460355060&ns=1&abbucket=0#detail
44.98,taobao,719275780455,泡泡袖遮肚子上衣女夏季2023新款法式甜美温柔高级感杏色短袖衬衫,左小姐来了,https://item.taobao.com/item.htm?id=719275780455&ns=1&abbucket=0#detail
43.9,tmall,699381460359,复古牛仔衬衫女2023新款春装设计感小众上衣叠穿休闲宽松外套衬衣,贞漫姿旗舰店,https://detail.tmall.com/item.htm?id=699381460359&ns=1&abbucket=0
39.9,taobao,708327037499,通勤简约气质纯色衬衫女2023春夏季韩版洋气温柔宽松休闲长袖衬衣,杭派时装原一加一外贸服装批发女装工厂店,https://item.taobao.com/item.htm?id=708327037499&ns=1&abbucket=0#detail
45.0,taobao,677458023668,时尚通勤垂感短袖衬衫2023年夏季新款女士气质温柔甜美显瘦上衣,芈默原创服饰,https://item.taobao.com/item.htm?id=677458023668&ns=1&abbucket=0#detail
55.0,taobao,717970324273,黄色短袖衬衫女日系上衣夏季新款2023法式设计感小众雪纺温柔衬衣,蝈蝈潮流服装室,https://item.taobao.com/item.htm?id=717970324273&ns=1&abbucket=0#detail
134.1,taobao,678272120415,宿本条纹衬衫套装女秋季2022新款高腰气质复古盘扣半身裙女三件套,宿本 与世界温柔相拥,https://item.taobao.com/item.htm?id=678272120415&ns=1&abbucket=0#detail
49.0,taobao,688408871400,反季清仓温柔学院风衬衫女春秋女装不规则上衣高级感宽松长袖衬衣,雅依美女装,https://item.taobao.com/item.htm?id=688408871400&ns=1&abbucket=0#detail
49.8,taobao,674216575628,法式浪漫温柔风2022夏新款气质V领宽松慵懒风显瘦短袖衬衫女上衣,原初外贸 高性价比品质女装,https://item.taobao.com/item.htm?id=674216575628&ns=1&abbucket=0#detail
37.98,taobao,709781396218,奶系温柔方领衬衫2023年夏季新款女装减龄荷叶边洋气独特别致上衣,黑牛奶 heiniunai,https://item.taobao.com/item.htm?id=709781396218&ns=1&abbucket=0#detail
49.9,taobao,671672437731,2022夏季韩版新款大码女士温柔风小衬衣胖MM花边V领提花白衬衫,媛媛外贸原单大码女装,https://item.taobao.com/item.htm?id=671672437731&ns=1&abbucket=0#detail
47.8,taobao,624037308145,春装设计感小众宽松大码白色雪纺衬衫女法式心机衬衣温柔长袖上衣,靓女原创女装店,https://item.taobao.com/item.htm?id=624037308145&ns=1&abbucket=0#detail
397.05,tmall,718939125876,雪纺衬衫女夏季2023新款别致漂亮碎花衬衣法式温柔气质木耳边上衣,花际服饰旗舰店,https://detail.tmall.com/item.htm?id=718939125876&ns=1&abbucket=0
64.9,tmall,703003425658,韩系减龄温柔风娃娃衫上衣女夏季洋气甜美蕾丝拼接宽松泡泡袖衬衫,翠香美旗舰店,https://detail.tmall.com/item.htm?id=703003425658&ns=1&abbucket=0
69.0,taobao,704494932988,2023早春新款法式温柔气质小众V领衬衫设计感木耳边泡泡袖衬衣女,千寻 小个子 轻文艺,https://item.taobao.com/item.htm?id=704494932988&ns=1&abbucket=0#detail
69.0,taobao,701787443495,大码法式别致衬衣春装女2023年新款微胖mm设计感小众显瘦衬衫上衣,咕晶蕾公主Girl大码女装,https://item.taobao.com/item.htm?id=701787443495&ns=1&abbucket=0#detail
75.0,tmall,672648077665,法式复古温柔小香风衬衫女夏短袖荷叶边V领短款赫本风泡泡袖上衣,妙果丝旗舰店,https://detail.tmall.com/item.htm?id=672648077665&ns=1&abbucket=0
65.0,taobao,718127149008,BM HCO法式方领纯欲收腰泡泡袖女夏季花边小个子甜美温柔白色衬衫,ATONG STUDIO 私服定制,https://item.taobao.com/item.htm?id=718127149008&ns=1&abbucket=0#detail
69.99,tmall,669642486958,森马长袖衬衫女2023夏季新款短款木耳边文艺温柔修身肌理白色衬衣,森马裕伟专卖店,https://detail.tmall.com/item.htm?id=669642486958&ns=1&abbucket=0
79.0,taobao,692699101526,chictang2023早春韩风温柔休闲粉色宽松气质ins衬衫上衣女鑫壹,chictang,https://item.taobao.com/item.htm?id=692699101526&ns=1&abbucket=0#detail
49.8,taobao,673635745048,法式复古撞色V领短袖衬衫女夏季2022年新款短款温柔时尚甜美上衣,小x滴店,https://item.taobao.com/item.htm?id=673635745048&ns=1&abbucket=0#detail
69.0,taobao,704719918144,花田橱窗HTmeme双层荷叶边衬衫女2023春夏新款气质温柔长袖衬衣潮,花田橱窗HTmeme 品牌,https://item.taobao.com/item.htm?id=704719918144&ns=1&abbucket=0#detail
189.0,tmall,682226184043,ISISLOVE红色格子花苞袖上衣女春季蕾丝镂空立领衬衫精致温柔小衫,isislove旗舰店,https://detail.tmall.com/item.htm?id=682226184043&ns=1&abbucket=0
39.99,taobao,705097855882,小清新学院风v领短袖衬衫上衣女夏季新款温柔风白色条纹别致衬衣,拉窝姐姐,https://item.taobao.com/item.htm?id=705097855882&ns=1&abbucket=0#detail
59.0,tmall,709445858395,法式高级感粉色条纹衬衫女夏季设计感小众薄款衬衣温柔防晒上衣潮,淘米迪旗舰店,https://detail.tmall.com/item.htm?id=709445858395&ns=1&abbucket=0
59.9,taobao,714868656926,专柜撤回国际大牌剪标港风披肩条纹短袖衬衫女夏季设计感别致上衣,小依家女装馆,https://item.taobao.com/item.htm?id=714868656926&ns=1&abbucket=0#detail
39.9,tmall,720715706986,法式气质减龄娃娃领短袖衬衫女夏季温柔小众独特别致显瘦上衣小衫,LPQFC旗舰店,https://detail.tmall.com/item.htm?id=720715706986&ns=1&abbucket=0
80.0,taobao,721111532787,chic韩国代购甜美少女感温柔米白色宽松荷叶袖方领蝴蝶结系带衬衫,Cin韩风韩国正品代购店,https://item.taobao.com/item.htm?id=721111532787&ns=1&abbucket=0#detail
66.99,taobao,722612178906,大码方领短袖衬衫女夏胖mm显瘦法式洋气减龄碎花小飞袖娃娃衫上衣,潮流女装 好质量,https://item.taobao.com/item.htm?id=722612178906&ns=1&abbucket=0#detail
178.0,tmall,723290535778,2023新款小众法式甜美小清新显瘦遮肉温柔风薄款蓝色格纹衬衫女夏,琳了旗舰店,https://detail.tmall.com/item.htm?id=723290535778&ns=1&abbucket=0
84.0,tmall,709111593771,粉色翻领衬衫女夏季外穿宽松薄款气质上衣高级感小个子防晒衫百搭,凤奢旗舰店,https://detail.tmall.com/item.htm?id=709111593771&ns=1&abbucket=0
29.0,taobao,708576311479,春季新款品牌女装正品温柔风印花直筒显瘦好搭单排扣衬衫 NR89221,稻草小良品牌折扣店,https://item.taobao.com/item.htm?id=708576311479&ns=1&abbucket=0#detail
438.0,tmall,670020253445,重磅真丝绸衬衫女2023春夏新款长袖褶皱温柔风纯色100%桑蚕丝上衣,科伦普旗舰店,https://detail.tmall.com/item.htm?id=670020253445&ns=1&abbucket=0
178.0,taobao,706047656365,ZS岛国珍珠双色绉流光溢彩~温柔气质防晒立领长袖衬衫上衣女夏季,天蓝家 高端女装,https://item.taobao.com/item.htm?id=706047656365&ns=1&abbucket=0#detail
323.1,tmall,705597250361,wana try【傅菁同款】白色花边系带超温柔纯棉衬衫长袖上衣内搭女,wanatry旗舰店,https://detail.tmall.com/item.htm?id=705597250361&ns=1&abbucket=0
25.0,taobao,723366655486,法式温柔风v领雪纺衬衫女春夏新款甜美设计感小众仙气上衣娃娃衫,品牌剪标女装清仓尾货正品,https://item.taobao.com/item.htm?id=723366655486&ns=1&abbucket=0#detail
39.98,taobao,719263109946,甜美温柔风荷叶边一字肩长袖衬衫女夏季法式宽松防晒衣度假风上衣,家有猫酱,https://item.taobao.com/item.htm?id=719263109946&ns=1&abbucket=0#detail
69.0,tmall,724443277800,娃娃领衬衫女夏季法式温柔上衣职业小个子职场轻熟风气质短袖通勤,煦珊旗舰店,https://detail.tmall.com/item.htm?id=724443277800&ns=1&abbucket=0
25.73,taobao,702050206762,夏季2023年新款复古宽松西装领短袖衬衫女装温柔百搭衬衣上衣学生,NS新港风服装,https://item.taobao.com/item.htm?id=702050206762&ns=1&abbucket=0#detail
75.0,taobao,675444559484,超仙荷叶边一字肩衬衫女高级感光泽温柔风欧纱洋气露肩上衣娃娃衫,乐言定制 精品实拍批发工厂店,https://item.taobao.com/item.htm?id=675444559484&ns=1&abbucket=0#detail
89.0,tmall,713433489579,蓝色天丝正肩短袖衬衫女夏季设计感小众立领衬衣法式泡泡袖上衣夏,巧娇雅旗舰店,https://detail.tmall.com/item.htm?id=713433489579&ns=1&abbucket=0
48.0,taobao,672815555531,法式温柔风蕾丝花边泡泡袖衬衫女夏季新款收腰荷叶边短袖上衣ins,小x滴店,https://item.taobao.com/item.htm?id=672815555531&ns=1&abbucket=0#detail
45.0,taobao,707058700700,品牌折扣店商场撤回外贸女装桑蚕丝温柔真丝衬衫小众设计感上衣,小马过河GM外贸,https://item.taobao.com/item.htm?id=707058700700&ns=1&abbucket=0#detail
59.0,tmall,723001958052,法式小香风肌理感一字领衬衫女2023夏新款泡泡袖甜美温柔漏肩上衣,福媛旗舰店,https://detail.tmall.com/item.htm?id=723001958052&ns=1&abbucket=0
84.0,taobao,675202491436,防晒波点棉麻衬衫女夏季外套温柔法式设计感小众日系亚麻上衣春秋,MoonNa 月亮娜娜,https://item.taobao.com/item.htm?id=675202491436&ns=1&abbucket=0#detail
59.0,taobao,719172156671,大码t恤女200斤设计感v领收腰显瘦碎花衬衫温柔风甜美减龄上衣夏,ALIN大码女装,https://item.taobao.com/item.htm?id=719172156671&ns=1&abbucket=0#detail
32.9,tmall,656587555079,港风格子长袖衬衫女春秋ins温柔风韩系chic港味复古早秋上衣外套,梦樱纯旗舰店,https://detail.tmall.com/item.htm?id=656587555079&ns=1&abbucket=0
66.0,tmall,655850070568,紫色衬衫女上衣设计感小众春秋复古港味雪纺温柔垂感气质长袖衬衣,悦在旗舰店,https://detail.tmall.com/item.htm?id=655850070568&ns=1&abbucket=0
89.0,taobao,673607902989,紫色棉麻衬衫女秋季薄款小众复古温柔感宽松八分袖香芋紫亚麻上衣,憨妮-STUDIO,https://item.taobao.com/item.htm?id=673607902989&ns=1&abbucket=0#detail
69.9,tmall,722338701577,法式小清新蓝色小飞袖上衣女小众设计感夏季甜美温柔风雪纺衬衫潮,荟盈旗舰店,https://detail.tmall.com/item.htm?id=722338701577&ns=1&abbucket=0
58.0,taobao,719636295680,ANAMONE 港风复古温柔短袖衬衫女夏设计感小众艺术生甜辣短款上衣,ANAMONE STUDIO,https://item.taobao.com/item.htm?id=719636295680&ns=1&abbucket=0#detail
45.89,taobao,710716549412,chictang2023春韩版温柔休闲chic粉色设计感上衣长袖衬衫女韵壹,chicming,https://item.taobao.com/item.htm?id=710716549412&ns=1&abbucket=0#detail
69.0,tmall,683764866103,粉色衬衫女春秋chic韩系高级外套设计感小众学院风软糯温柔衬衣潮,潮美臣旗舰店,https://detail.tmall.com/item.htm?id=683764866103&ns=1&abbucket=0
40.98,taobao,718310765928,荷叶边小飞袖衬衫女夏季设计感小众法式别致绝美韩系温柔chic上衣,HL哈喽妹妹,https://item.taobao.com/item.htm?id=718310765928&ns=1&abbucket=0#detail
24.9,taobao,724009703662,韩版小众温柔甜美波点雪纺衬衫女春夏新款宽松显瘦荷叶边长袖上衣,杭派时装原一加一外贸服装批发女装工厂店,https://item.taobao.com/item.htm?id=724009703662&ns=1&abbucket=0#detail
96.0,taobao,719163096109,法式温柔木耳边甜美衬衫女夏季新款宽松休闲减龄洋气小衫短袖上衣,杭州婉儿四季青批发女装,https://item.taobao.com/item.htm?id=719163096109&ns=1&abbucket=0#detail
79.0,taobao,706229228795,夏季新款女装精致刺绣温柔镂空衬衣女褶皱设计长袖衬衫显瘦上衣女,网红潮韩女装,https://item.taobao.com/item.htm?id=706229228795&ns=1&abbucket=0#detail
69.0,tmall,704827484915,早秋装女2023年新款格子衬衫设计感小众防晒衬衣法式独特别致上衣,月中维旗舰店,https://detail.tmall.com/item.htm?id=704827484915&ns=1&abbucket=0
79.0,taobao,722463700126,新中式气质温柔风盘扣衬衫2023夏季女装女装别致设计感泡泡袖上衣,荟琳奴高端名媛轻奢女装,https://item.taobao.com/item.htm?id=722463700126&ns=1&abbucket=0#detail
438.0,tmall,670020253445,重磅真丝绸衬衫女2023春夏新款长袖褶皱温柔风纯色100%桑蚕丝上衣,科伦普旗舰店,https://detail.tmall.com/item.htm?id=670020253445&ns=1&abbucket=0
178.0,taobao,706047656365,ZS岛国珍珠双色绉流光溢彩~温柔气质防晒立领长袖衬衫上衣女夏季,天蓝家 高端女装,https://item.taobao.com/item.htm?id=706047656365&ns=1&abbucket=0#detail
323.1,tmall,705597250361,wana try【傅菁同款】白色花边系带超温柔纯棉衬衫长袖上衣内搭女,wanatry旗舰店,https://detail.tmall.com/item.htm?id=705597250361&ns=1&abbucket=0
25.0,taobao,723366655486,法式温柔风v领雪纺衬衫女春夏新款甜美设计感小众仙气上衣娃娃衫,品牌剪标女装清仓尾货正品,https://item.taobao.com/item.htm?id=723366655486&ns=1&abbucket=0#detail
39.98,taobao,719263109946,甜美温柔风荷叶边一字肩长袖衬衫女夏季法式宽松防晒衣度假风上衣,家有猫酱,https://item.taobao.com/item.htm?id=719263109946&ns=1&abbucket=0#detail
69.0,tmall,724443277800,娃娃领衬衫女夏季法式温柔上衣职业小个子职场轻熟风气质短袖通勤,煦珊旗舰店,https://detail.tmall.com/item.htm?id=724443277800&ns=1&abbucket=0
25.73,taobao,702050206762,夏季2023年新款复古宽松西装领短袖衬衫女装温柔百搭衬衣上衣学生,NS新港风服装,https://item.taobao.com/item.htm?id=702050206762&ns=1&abbucket=0#detail
75.0,taobao,675444559484,超仙荷叶边一字肩衬衫女高级感光泽温柔风欧纱洋气露肩上衣娃娃衫,乐言定制 精品实拍批发工厂店,https://item.taobao.com/item.htm?id=675444559484&ns=1&abbucket=0#detail
89.0,tmall,713433489579,蓝色天丝正肩短袖衬衫女夏季设计感小众立领衬衣法式泡泡袖上衣夏,巧娇雅旗舰店,https://detail.tmall.com/item.htm?id=713433489579&ns=1&abbucket=0
48.0,taobao,672815555531,法式温柔风蕾丝花边泡泡袖衬衫女夏季新款收腰荷叶边短袖上衣ins,小x滴店,https://item.taobao.com/item.htm?id=672815555531&ns=1&abbucket=0#detail
45.0,taobao,707058700700,品牌折扣店商场撤回外贸女装桑蚕丝温柔真丝衬衫小众设计感上衣,小马过河GM外贸,https://item.taobao.com/item.htm?id=707058700700&ns=1&abbucket=0#detail
59.0,tmall,723001958052,法式小香风肌理感一字领衬衫女2023夏新款泡泡袖甜美温柔漏肩上衣,福媛旗舰店,https://detail.tmall.com/item.htm?id=723001958052&ns=1&abbucket=0
84.0,taobao,675202491436,防晒波点棉麻衬衫女夏季外套温柔法式设计感小众日系亚麻上衣春秋,MoonNa 月亮娜娜,https://item.taobao.com/item.htm?id=675202491436&ns=1&abbucket=0#detail
59.0,taobao,719172156671,大码t恤女200斤设计感v领收腰显瘦碎花衬衫温柔风甜美减龄上衣夏,ALIN大码女装,https://item.taobao.com/item.htm?id=719172156671&ns=1&abbucket=0#detail
32.9,tmall,656587555079,港风格子长袖衬衫女春秋ins温柔风韩系chic港味复古早秋上衣外套,梦樱纯旗舰店,https://detail.tmall.com/item.htm?id=656587555079&ns=1&abbucket=0
66.0,tmall,655850070568,紫色衬衫女上衣设计感小众春秋复古港味雪纺温柔垂感气质长袖衬衣,悦在旗舰店,https://detail.tmall.com/item.htm?id=655850070568&ns=1&abbucket=0
89.0,taobao,673607902989,紫色棉麻衬衫女秋季薄款小众复古温柔感宽松八分袖香芋紫亚麻上衣,憨妮-STUDIO,https://item.taobao.com/item.htm?id=673607902989&ns=1&abbucket=0#detail
69.9,tmall,722338701577,法式小清新蓝色小飞袖上衣女小众设计感夏季甜美温柔风雪纺衬衫潮,荟盈旗舰店,https://detail.tmall.com/item.htm?id=722338701577&ns=1&abbucket=0
58.0,taobao,719636295680,ANAMONE 港风复古温柔短袖衬衫女夏设计感小众艺术生甜辣短款上衣,ANAMONE STUDIO,https://item.taobao.com/item.htm?id=719636295680&ns=1&abbucket=0#detail
45.89,taobao,710716549412,chictang2023春韩版温柔休闲chic粉色设计感上衣长袖衬衫女韵壹,chicming,https://item.taobao.com/item.htm?id=710716549412&ns=1&abbucket=0#detail
69.0,tmall,683764866103,粉色衬衫女春秋chic韩系高级外套设计感小众学院风软糯温柔衬衣潮,潮美臣旗舰店,https://detail.tmall.com/item.htm?id=683764866103&ns=1&abbucket=0
40.98,taobao,718310765928,荷叶边小飞袖衬衫女夏季设计感小众法式别致绝美韩系温柔chic上衣,HL哈喽妹妹,https://item.taobao.com/item.htm?id=718310765928&ns=1&abbucket=0#detail
24.9,taobao,724009703662,韩版小众温柔甜美波点雪纺衬衫女春夏新款宽松显瘦荷叶边长袖上衣,杭派时装原一加一外贸服装批发女装工厂店,https://item.taobao.com/item.htm?id=724009703662&ns=1&abbucket=0#detail
96.0,taobao,719163096109,法式温柔木耳边甜美衬衫女夏季新款宽松休闲减龄洋气小衫短袖上衣,杭州婉儿四季青批发女装,https://item.taobao.com/item.htm?id=719163096109&ns=1&abbucket=0#detail
79.0,taobao,706229228795,夏季新款女装精致刺绣温柔镂空衬衣女褶皱设计长袖衬衫显瘦上衣女,网红潮韩女装,https://item.taobao.com/item.htm?id=706229228795&ns=1&abbucket=0#detail
69.0,tmall,704827484915,早秋装女2023年新款格子衬衫设计感小众防晒衬衣法式独特别致上衣,月中维旗舰店,https://detail.tmall.com/item.htm?id=704827484915&ns=1&abbucket=0
79.0,taobao,722463700126,新中式气质温柔风盘扣衬衫2023夏季女装女装别致设计感泡泡袖上衣,荟琳奴高端名媛轻奢女装,https://item.taobao.com/item.htm?id=722463700126&ns=1&abbucket=0#detail
99.99,taobao,721968341448,炒温柔！爱了爱了！贼好看 重工蕾丝刺绣圆领小香风短袖衬衫女,小仙家精品店,https://item.taobao.com/item.htm?id=721968341448&ns=1&abbucket=0#detail
79.0,tmall,713890286019,V领泡泡袖衬衫女2023夏季新款甜美法式条纹衬衣短款蕾丝杏色上衣,贝罗奈旗舰店,https://detail.tmall.com/item.htm?id=713890286019&ns=1&abbucket=0
83.0,taobao,724619531125,法式短袖衬衫女夏日系学院风小众温柔甜美蓝色衬衣休闲POLO领上衣,妤琪Studio,https://item.taobao.com/item.htm?id=724619531125&ns=1&abbucket=0#detail
69.0,tmall,695675181364,荷叶领女温柔风棉麻蕾丝拼接法式长袖小衫宽松压褶花瓣衬衫上衣秋,派梦雅旗舰店,https://detail.tmall.com/item.htm?id=695675181364&ns=1&abbucket=0
37.98,taobao,719852923257,紫色气质肌理感温柔风衬衫女夏季2023新款洋气泡泡袖宽松圆领上衣,下架学姐XJXJ,https://item.taobao.com/item.htm?id=719852923257&ns=1&abbucket=0#detail
54.9,tmall,712403135049,法式V领荷叶边紫色衬衫女春夏季甜美温柔长袖小衫高级感洋气上衣,奢孜旗舰店,https://detail.tmall.com/item.htm?id=712403135049&ns=1&abbucket=0
58.98,taobao,680098679554,韩系温柔风系带露肩长袖衬衫女夏季2023新款仙女小众宽松显瘦上衣,花木匠Flower Crafter,https://item.taobao.com/item.htm?id=680098679554&ns=1&abbucket=0#detail
89.0,taobao,722738056730,温柔风蕾丝领真丝白衬衫女2023夏季设计感小众别致漂亮桑蚕丝小衫,莱丝特外贸真丝女装,https://item.taobao.com/item.htm?id=722738056730&ns=1&abbucket=0#detail
178.0,taobao,722951017128,Myra 温柔小众设计感休闲圆领衬衫女短袖不规则拼接棉布上衣夏季,Myra陌拉,https://item.taobao.com/item.htm?id=722951017128&ns=1&abbucket=0#detail
89.0,taobao,694426651953,chictang2023早春韩风休闲温柔粉色圆领蝴蝶结圆领衬衫套头女財叁,chictang,https://item.taobao.com/item.htm?id=694426651953&ns=1&abbucket=0#detail
329.0,taobao,695232848063,南法温柔 小可爱 波点刺绣花边领棉衬衫女春天家H 2E92,春天家 轻奢高品质,https://item.taobao.com/item.htm?id=695232848063&ns=1&abbucket=0#detail
88.0,taobao,706929367894,法式温柔设计小众荷叶边短款衬衫女春夏新款气质甜美仙气露肩上衣,小C家美衣,https://item.taobao.com/item.htm?id=706929367894&ns=1&abbucket=0#detail
139.0,taobao,697350944669,XINER 圆领衬衫女设计款小众吸晴金一粒扣温柔淑女风小衫宽松上衣,XINER 吾欣儿,https://item.taobao.com/item.htm?id=697350944669&ns=1&abbucket=0#detail
28.71,taobao,718487884482,甜美别致娃娃领短袖衬衫女夏季设计感小众温柔系衬衣宽松韩系上衣,贝芝女装折扣店,https://item.taobao.com/item.htm?id=718487884482&ns=1&abbucket=0#detail
83.0,tmall,673133757802,粉色减龄木耳领衬衫女短袖2022夏季温柔系穿搭外穿上衣纯棉衬衣,初影旗舰店,https://detail.tmall.com/item.htm?id=673133757802&ns=1&abbucket=0
88.0,taobao,694931966726,复古法式宫廷风花边衬衫女尖领加厚双面缎温柔气质衬衣,猴猴HOUHOU,https://item.taobao.com/item.htm?id=694931966726&ns=1&abbucket=0#detail
67.0,tmall,721036480590,大码胖mm韩版学院风泡泡袖短款上衣女夏季小个子温柔薄款短袖衬衫,伟姬旗舰店,https://detail.tmall.com/item.htm?id=721036480590&ns=1&abbucket=0
34.98,taobao,642273403605,韩风chic气质泡泡袖衬衫女夏季小众设计感温柔洋气杏色上衣小衫,JRM简而美,https://item.taobao.com/item.htm?id=642273403605&ns=1&abbucket=0#detail
88.0,taobao,678099091906,法式温柔一字领衬衫 舒适丝滑洋气减龄上衣 韩版衬衣短袖t恤女夏,小语故事,https://item.taobao.com/item.htm?id=678099091906&ns=1&abbucket=0#detail
55.0,taobao,710701223557,甜美洋气刺绣娃娃领衬衫女设计感夏季温柔风短款泡泡短袖衬衣isn,森木子 韩国女装,https://item.taobao.com/item.htm?id=710701223557&ns=1&abbucket=0#detail
32.9,tmall,679739856545,法式v领短袖衬衫女夏季2023新款漂亮小衫收腰独特别致小上衣早秋,草子木衣旗舰店,https://detail.tmall.com/item.htm?id=679739856545&ns=1&abbucket=0
206.0,taobao,669984879592,麦呈 高级感温柔色系小众设计感长袖衬衫女灰色通勤简约上衣翻领,麦呈 mallcezz,https://item.taobao.com/item.htm?id=669984879592&ns=1&abbucket=0#detail
79.99,taobao,714315330525,新中式复古盘扣短袖衬衫女夏季独特提花设计感气质温柔泡泡袖上衣,miss简尚女装,https://item.taobao.com/item.htm?id=714315330525&ns=1&abbucket=0#detail
59.0,taobao,725322627976,猪欧尼 韩国ins夏季温柔少女蕾丝花边圆领后背系扣无袖背心衬衫,猪欧尼sunnypig,https://item.taobao.com/item.htm?id=725322627976&ns=1&abbucket=0#detail
59.0,taobao,702537123058,2023新款吊带一字肩泡泡长袖温柔风设计感衬衫春秋款气质上衣女,朵来美在这里,https://item.taobao.com/item.htm?id=702537123058&ns=1&abbucket=0#detail
38.98,taobao,723874607036,一字领碎花短袖雪纺衬衫女夏季法式甜美温柔风衬衫短款泡泡袖上衣,拾柒同学,https://item.taobao.com/item.htm?id=723874607036&ns=1&abbucket=0#detail
29.0,taobao,719215781780,沈月同款小清新温柔系长袖衬衫上衣2023新款女装薄款防晒衬衣外套,lingling家啦,https://item.taobao.com/item.htm?id=719215781780&ns=1&abbucket=0#detail
69.0,taobao,711082894409,设计感小众泡泡袖碎花衬衫女2023夏季新款温柔风洋气减龄雪纺上衣,与衣二三事,https://item.taobao.com/item.htm?id=711082894409&ns=1&abbucket=0#detail
78.0,taobao,710323278002,the lemon法式一字领泡泡袖衬衫23夏季新品韩范气质温柔风上衣 女,十三行女装零售批发店,https://item.taobao.com/item.htm?id=710323278002&ns=1&abbucket=0#detail
69.8,taobao,718404647803,韩系甜美气质方领泡泡袖衬衫女夏季温柔风收腰短款上衣减龄小衫,酸柠檬 SNM STUDIO,https://item.taobao.com/item.htm?id=718404647803&ns=1&abbucket=0#detail
75.0,taobao,723065520950,日系温柔气质风单排扣仙气短袖衬衫女棉麻波点印花宽松上衣森女夏,梦薇家 韩国chic女装,https://item.taobao.com/item.htm?id=723065520950&ns=1&abbucket=0#detail
126.0,taobao,717435110367,法式温柔风玫瑰碎花衬衫女2023夏季新款洋气蕾丝拼接灯笼袖小衫潮,小姐妹欧货女装,https://item.taobao.com/item.htm?id=717435110367&ns=1&abbucket=0#detail
190.0,taobao,705130445372,【商场同款】LILY秋新款女装优雅泡泡袖别致镂空温柔短袖衬衫,lily官方折扣店,https://item.taobao.com/item.htm?id=705130445372&ns=1&abbucket=0#detail
139.0,taobao,681759890296,2023法式衬衫女温柔独特别致上衣收腰韩系风格穿搭洋气小衫短款,奈可的小店,https://item.taobao.com/item.htm?id=681759890296&ns=1&abbucket=0#detail
69.9,taobao,719024949022,fromanna韩系复古圆领花摆泡泡袖衬衫女2023夏季新款温柔百搭上衣,星海 SEVEN 韩国女装批发店,https://item.taobao.com/item.htm?id=719024949022&ns=1&abbucket=0#detail
45.9,taobao,715112794860,夏季小众法式复古设计感圆领泡泡袖衬衫上衣温柔甜美女生2023新款,三公主小个子定制女装,https://item.taobao.com/item.htm?id=715112794860&ns=1&abbucket=0#detail
143.0,taobao,713809786872,温柔系百搭高级感V领荷叶边衬衫女春夏季别致绝美泡泡袖绿色上衣,格式女装店,https://item.taobao.com/item.htm?id=713809786872&ns=1&abbucket=0#detail
